number,value,datetime_start,datetime_complete,duration,params_hmm_components,params_hmm_favourable,params_hmm_gate,params_hmm_threshold,params_hmm_train_years,state
408,12.948212085456005,2026-04-03 15:19:12.502163,2026-04-03 15:19:12.914164,0 days 00:00:00.412001,4,2,threshold,0.7171354871813511,6.669912571442023,COMPLETE
409,13.577848510305863,2026-04-03 15:19:12.914285,2026-04-03 15:19:13.328860,0 days 00:00:00.414575,4,2,logistic,0.746388628304165,5.676229045607764,COMPLETE
410,13.577848510305863,2026-04-03 15:19:13.328981,2026-04-03 15:19:13.779109,0 days 00:00:00.450128,4,2,threshold,0.7235497093886973,5.38422825297882,COMPLETE
411,12.965532642733175,2026-04-03 15:19:13.779229,2026-04-03 15:19:14.203186,0 days 00:00:00.423957,4,2,logistic,0.8310426486849739,6.504988650820924,COMPLETE
412,12.928162568324508,2026-04-03 15:19:14.203331,2026-04-03 15:19:14.626234,0 days 00:00:00.422903,4,2,threshold,0.6961990457053636,6.1855193074961035,COMPLETE
413,13.577848510305863,2026-04-03 15:19:14.626401,2026-04-03 15:19:15.047260,0 days 00:00:00.420859,4,2,threshold,0.7384913042333433,5.183491599958082,COMPLETE
414,12.965532642733175,2026-04-03 15:19:15.047381,2026-04-03 15:19:15.470856,0 days 00:00:00.423475,4,2,logistic,0.7532734773287855,5.452210014050168,COMPLETE
415,13.577848510305863,2026-04-03 15:19:15.470978,2026-04-03 15:19:15.890150,0 days 00:00:00.419172,4,2,threshold,0.729856990490424,6.08552139834297,COMPLETE
416,12.965532642733175,2026-04-03 15:19:15.890267,2026-04-03 15:19:16.304905,0 days 00:00:00.414638,4,2,threshold,0.7679497527683454,6.316046397140299,COMPLETE
417,13.577848510305863,2026-04-03 15:19:16.305031,2026-04-03 15:19:16.720593,0 days 00:00:00.415562,4,2,logistic,0.7346383825277385,5.555648426587205,COMPLETE
418,13.577848510305863,2026-04-03 15:19:16.720720,2026-04-03 15:19:17.174128,0 days 00:00:00.453408,4,2,threshold,0.7448748491771505,5.707518966304719,COMPLETE
419,12.948212085456005,2026-04-03 15:19:17.174249,2026-04-03 15:19:17.586144,0 days 00:00:00.411895,4,2,logistic,0.7204322143298459,4.992091851217202,COMPLETE
420,12.965532642733175,2026-04-03 15:19:17.586263,2026-04-03 15:19:18.005994,0 days 00:00:00.419731,4,2,threshold,0.7587166264055935,5.134876974020469,COMPLETE
421,12.948212085456005,2026-04-03 15:19:18.006118,2026-04-03 15:19:18.418653,0 days 00:00:00.412535,4,2,threshold,0.7113934765166487,6.565660488791012,COMPLETE
422,13.577848510305863,2026-04-03 15:19:18.418773,2026-04-03 15:19:18.835220,0 days 00:00:00.416447,4,2,logistic,0.7297310095210675,5.254617408510029,COMPLETE
423,3.4856152817995465,2026-04-03 15:19:18.835346,2026-04-03 15:19:19.236817,0 days 00:00:00.401471,4,1,threshold,0.7418485281365685,5.906223312817307,COMPLETE
424,13.577848510305863,2026-04-03 15:19:19.236968,2026-04-03 15:19:19.651388,0 days 00:00:00.414420,4,2,threshold,0.7239929351215452,5.607019846956118,COMPLETE
425,12.965532642733175,2026-04-03 15:19:19.651512,2026-04-03 15:19:20.069693,0 days 00:00:00.418181,4,2,logistic,0.7510859850785024,5.403935645443849,COMPLETE
426,13.577848510305863,2026-04-03 15:19:20.069819,2026-04-03 15:19:20.522319,0 days 00:00:00.452500,4,2,threshold,0.7348605637024266,6.402424239569811,COMPLETE
427,13.577848510305863,2026-04-03 15:19:20.522444,2026-04-03 15:19:20.935396,0 days 00:00:00.412952,4,2,logistic,0.7423732537877066,5.78091888715462,COMPLETE
428,13.577848510305863,2026-04-03 15:19:20.935515,2026-04-03 15:19:21.354334,0 days 00:00:00.418819,4,2,threshold,0.7304495490335748,5.324710896025211,COMPLETE
429,12.948212085456005,2026-04-03 15:19:21.354459,2026-04-03 15:19:21.770572,0 days 00:00:00.416113,4,2,threshold,0.7146840083567544,5.5127542448475255,COMPLETE
430,12.965532642733175,2026-04-03 15:19:21.770696,2026-04-03 15:19:22.183910,0 days 00:00:00.413214,4,2,logistic,0.7487847480190903,6.024730728076867,COMPLETE
431,12.948212085456005,2026-04-03 15:19:22.184031,2026-04-03 15:19:22.597263,0 days 00:00:00.413232,4,2,threshold,0.7015824674619358,6.678138493741905,COMPLETE
432,13.577848510305863,2026-04-03 15:19:22.597385,2026-04-03 15:19:23.011454,0 days 00:00:00.414069,4,2,threshold,0.7376302027446727,6.273912680394171,COMPLETE
433,12.965532642733175,2026-04-03 15:19:23.011581,2026-04-03 15:19:23.423061,0 days 00:00:00.411480,4,2,logistic,0.7752964054646955,6.54120684244157,COMPLETE
434,13.577848510305863,2026-04-03 15:19:23.423185,2026-04-03 15:19:23.874971,0 days 00:00:00.451786,4,2,threshold,0.7238623823083475,5.635410792860846,COMPLETE
435,12.965532642733175,2026-04-03 15:19:23.875093,2026-04-03 15:19:24.290792,0 days 00:00:00.415699,4,2,logistic,0.757571364062011,5.417849638246235,COMPLETE
436,4.621809414351053,2026-04-03 15:19:24.290914,2026-04-03 15:19:24.712585,0 days 00:00:00.421671,6,2,threshold,0.7313287588198857,5.060673836266292,COMPLETE
437,13.577848510305863,2026-04-03 15:19:24.712704,2026-04-03 15:19:25.130322,0 days 00:00:00.417618,4,2,threshold,0.7431129584543273,5.253337104175024,COMPLETE
438,12.948212085456005,2026-04-03 15:19:25.130446,2026-04-03 15:19:25.544444,0 days 00:00:00.413998,4,2,logistic,0.7195134907869577,6.163899187897134,COMPLETE
439,13.577848510305863,2026-04-03 15:19:25.544571,2026-04-03 15:19:25.964743,0 days 00:00:00.420172,4,2,threshold,0.7381624459473587,6.778053554499511,COMPLETE
440,12.928162568324508,2026-04-03 15:19:25.964874,2026-04-03 15:19:26.385177,0 days 00:00:00.420303,4,2,threshold,0.680253754769099,5.847489014441617,COMPLETE
441,12.965532642733175,2026-04-03 15:19:26.385299,2026-04-03 15:19:26.803922,0 days 00:00:00.418623,4,2,logistic,0.7511557029813489,5.534869258585137,COMPLETE
442,13.577848510305863,2026-04-03 15:19:26.804049,2026-04-03 15:19:27.259947,0 days 00:00:00.455898,4,2,threshold,0.7291207237630659,6.420777178916026,COMPLETE
443,13.577848510305863,2026-04-03 15:19:27.260068,2026-04-03 15:19:27.675001,0 days 00:00:00.414933,4,2,logistic,0.7369170238638175,5.684821698087872,COMPLETE
444,13.577848510305863,2026-04-03 15:19:27.675123,2026-04-03 15:19:28.087598,0 days 00:00:00.412475,4,2,threshold,0.7456754382354064,5.3291361480033554,COMPLETE
445,12.948212085456005,2026-04-03 15:19:28.087716,2026-04-03 15:19:28.509821,0 days 00:00:00.422105,4,2,threshold,0.7102786158064154,5.465485495483958,COMPLETE
446,12.965532642733175,2026-04-03 15:19:28.509945,2026-04-03 15:19:28.925260,0 days 00:00:00.415315,4,2,logistic,0.765263965769727,6.3191450890297665,COMPLETE
447,13.577848510305863,2026-04-03 15:19:28.925380,2026-04-03 15:19:29.342907,0 days 00:00:00.417527,4,2,threshold,0.7261621299763463,6.5073308383222725,COMPLETE
448,12.965532642733175,2026-04-03 15:19:29.343033,2026-04-03 15:19:29.768296,0 days 00:00:00.425263,4,2,threshold,0.7535289936476881,4.879977104455249,COMPLETE
449,13.577848510305863,2026-04-03 15:19:29.768426,2026-04-03 15:19:30.189940,0 days 00:00:00.421514,4,2,logistic,0.7350569097566573,5.097922878016761,COMPLETE
450,13.577848510305863,2026-04-03 15:19:30.190065,2026-04-03 15:19:30.651696,0 days 00:00:00.461631,4,2,threshold,0.7436921783479771,7.0370351331048395,COMPLETE
451,12.948212085456005,2026-04-03 15:19:30.651820,2026-04-03 15:19:31.066130,0 days 00:00:00.414310,4,2,logistic,0.7183800578715968,4.641091704213181,COMPLETE
452,13.577848510305863,2026-04-03 15:19:31.066252,2026-04-03 15:19:31.494527,0 days 00:00:00.428275,4,2,threshold,0.7292473229270532,6.637900254935519,COMPLETE
453,13.577848510305863,2026-04-03 15:19:31.494661,2026-04-03 15:19:31.911494,0 days 00:00:00.416833,4,2,threshold,0.7393059469790179,5.20305013884866,COMPLETE
454,12.965532642733175,2026-04-03 15:19:31.911615,2026-04-03 15:19:32.327741,0 days 00:00:00.416126,4,2,logistic,0.7593342617141823,5.7995780884577846,COMPLETE
455,13.577848510305863,2026-04-03 15:19:32.327862,2026-04-03 15:19:32.744804,0 days 00:00:00.416942,4,2,threshold,0.7239298700608449,5.591720072173511,COMPLETE
456,12.965532642733175,2026-04-03 15:19:32.744926,2026-04-03 15:19:33.158569,0 days 00:00:00.413643,4,2,threshold,0.749488744838581,5.396149756858294,COMPLETE
457,13.577848510305863,2026-04-03 15:19:33.158695,2026-04-03 15:19:33.574236,0 days 00:00:00.415541,4,2,logistic,0.7333725765989358,6.032473750372229,COMPLETE
458,12.965532642733175,2026-04-03 15:19:33.574362,2026-04-03 15:19:34.029454,0 days 00:00:00.455092,4,2,threshold,0.8041118709073751,5.302064457143339,COMPLETE
459,13.577848510305863,2026-04-03 15:19:34.029578,2026-04-03 15:19:34.444464,0 days 00:00:00.414886,4,2,logistic,0.7430381726092552,5.719813195816179,COMPLETE
460,3.4856152817995465,2026-04-03 15:19:34.444580,2026-04-03 15:19:34.849104,0 days 00:00:00.404524,4,1,threshold,0.719119410445444,5.903819938278199,COMPLETE
461,13.577848510305863,2026-04-03 15:19:34.849221,2026-04-03 15:19:35.264907,0 days 00:00:00.415686,4,2,threshold,0.731949805829311,5.513867441571023,COMPLETE
462,12.965532642733175,2026-04-03 15:19:35.265025,2026-04-03 15:19:35.680893,0 days 00:00:00.415868,4,2,logistic,0.7488463556124547,6.1393823876218345,COMPLETE
463,12.948212085456005,2026-04-03 15:19:35.681017,2026-04-03 15:19:36.097985,0 days 00:00:00.416968,4,2,threshold,0.7069721622573575,4.971955810480858,COMPLETE
464,7.2137439410583175,2026-04-03 15:19:36.098126,2026-04-03 15:19:36.511601,0 days 00:00:00.413475,3,1,threshold,0.739760598986661,5.16909969017077,COMPLETE
465,13.577848510305863,2026-04-03 15:19:36.511720,2026-04-03 15:19:36.929361,0 days 00:00:00.417641,4,2,logistic,0.7263981057105324,6.41471737827436,COMPLETE
466,2.6267423900416906,2026-04-03 15:19:36.929481,2026-04-03 15:19:37.435799,0 days 00:00:00.506318,5,2,threshold,0.7145180514320433,5.429199168777642,COMPLETE
467,12.965532642733175,2026-04-03 15:19:37.435922,2026-04-03 15:19:37.854201,0 days 00:00:00.418279,4,2,logistic,0.7555909248052697,5.639147588061565,COMPLETE
468,13.577848510305863,2026-04-03 15:19:37.854325,2026-04-03 15:19:38.270288,0 days 00:00:00.415963,4,2,threshold,0.7345738316520546,6.574834165690651,COMPLETE
469,13.577848510305863,2026-04-03 15:19:38.270411,2026-04-03 15:19:38.687758,0 days 00:00:00.417347,4,2,threshold,0.742846675078598,6.276657303090623,COMPLETE
470,13.577848510305863,2026-04-03 15:19:38.687882,2026-04-03 15:19:39.100816,0 days 00:00:00.412934,4,2,logistic,0.7263244520884546,5.572246364615035,COMPLETE
471,12.965532642733175,2026-04-03 15:19:39.100941,2026-04-03 15:19:39.513718,0 days 00:00:00.412777,4,2,threshold,0.7500735749331354,6.711815816262728,COMPLETE
472,13.577848510305863,2026-04-03 15:19:39.513851,2026-04-03 15:19:39.927698,0 days 00:00:00.413847,4,2,threshold,0.7352922999480602,5.353405654433791,COMPLETE
473,12.797069396644059,2026-04-03 15:19:39.927823,2026-04-03 15:19:40.342620,0 days 00:00:00.414797,4,2,logistic,0.8555975975126076,6.473223247101214,COMPLETE
474,12.948212085456005,2026-04-03 15:19:40.342739,2026-04-03 15:19:40.795112,0 days 00:00:00.452373,4,2,threshold,0.722190839353765,5.956497728596233,COMPLETE
475,13.577848510305863,2026-04-03 15:19:40.795232,2026-04-03 15:19:41.211967,0 days 00:00:00.416735,4,2,logistic,0.7399843390433543,5.26795278533009,COMPLETE
476,12.965532642733175,2026-04-03 15:19:41.212089,2026-04-03 15:19:41.625152,0 days 00:00:00.413063,4,2,threshold,0.7603625897155389,5.488965740967966,COMPLETE
477,13.577848510305863,2026-04-03 15:19:41.625273,2026-04-03 15:19:42.039291,0 days 00:00:00.414018,4,2,threshold,0.7302908867818174,5.766348976089727,COMPLETE
478,12.965532642733175,2026-04-03 15:19:42.039412,2026-04-03 15:19:42.454600,0 days 00:00:00.415188,4,2,logistic,0.7684423039835226,4.789150471858928,COMPLETE
479,12.984244697268876,2026-04-03 15:19:42.454724,2026-04-03 15:19:42.850960,0 days 00:00:00.396236,2,1,threshold,0.7466988569188356,6.355316955846548,COMPLETE
480,12.948212085456005,2026-04-03 15:19:42.851085,2026-04-03 15:19:43.265045,0 days 00:00:00.413960,4,2,threshold,0.7161607161600949,5.093957555928294,COMPLETE
481,13.577848510305863,2026-04-03 15:19:43.265166,2026-04-03 15:19:43.679888,0 days 00:00:00.414722,4,2,logistic,0.7339317613730998,5.423925320975611,COMPLETE
482,13.577848510305863,2026-04-03 15:19:43.680007,2026-04-03 15:19:44.160372,0 days 00:00:00.480365,4,2,threshold,0.7231212661027039,6.8106794303845835,COMPLETE
483,12.965532642733175,2026-04-03 15:19:44.160513,2026-04-03 15:19:44.599275,0 days 00:00:00.438762,4,2,logistic,0.753230840937757,5.6587897824641455,COMPLETE
484,13.577848510305863,2026-04-03 15:19:44.599421,2026-04-03 15:19:45.091182,0 days 00:00:00.491761,4,2,threshold,0.7436939909711681,6.206358137295859,COMPLETE
485,13.577848510305863,2026-04-03 15:19:45.091329,2026-04-03 15:19:45.560957,0 days 00:00:00.469628,4,2,threshold,0.7388020614346118,6.6013345459629225,COMPLETE
486,13.577848510305863,2026-04-03 15:19:45.561113,2026-04-03 15:19:46.026974,0 days 00:00:00.465861,4,2,logistic,0.7288277537807922,6.105275375147885,COMPLETE
487,12.948212085456005,2026-04-03 15:19:46.027113,2026-04-03 15:19:46.444962,0 days 00:00:00.417849,4,2,threshold,0.706531929858478,5.199462793632087,COMPLETE
488,13.577848510305863,2026-04-03 15:19:46.445089,2026-04-03 15:19:46.864231,0 days 00:00:00.419142,4,2,threshold,0.746294379210625,5.514482168865021,COMPLETE
489,12.948212085456005,2026-04-03 15:19:46.864399,2026-04-03 15:19:47.310794,0 days 00:00:00.446395,4,2,logistic,0.7169408996442582,5.326066384330697,COMPLETE
490,13.577848510305863,2026-04-03 15:19:47.310921,2026-04-03 15:19:47.777987,0 days 00:00:00.467066,4,2,threshold,0.7347716936884352,5.844009825653898,COMPLETE
491,12.965532642733175,2026-04-03 15:19:47.778112,2026-04-03 15:19:48.204823,0 days 00:00:00.426711,4,2,logistic,0.7579294414549709,6.449314104402468,COMPLETE
492,13.577848510305863,2026-04-03 15:19:48.204951,2026-04-03 15:19:48.637508,0 days 00:00:00.432557,4,2,threshold,0.7269400760433422,5.57330286618154,COMPLETE
493,13.577848510305863,2026-04-03 15:19:48.637639,2026-04-03 15:19:49.166009,0 days 00:00:00.528370,4,2,threshold,0.7384164929025192,5.745208065548878,COMPLETE
494,11.385404336141029,2026-04-03 15:19:49.166138,2026-04-03 15:19:49.591144,0 days 00:00:00.425006,4,2,logistic,0.9619202998493918,5.004510230552552,COMPLETE
495,12.965532642733175,2026-04-03 15:19:49.591268,2026-04-03 15:19:50.010726,0 days 00:00:00.419458,4,2,threshold,0.7499596597145728,6.518098241652922,COMPLETE
496,13.577848510305863,2026-04-03 15:19:50.010854,2026-04-03 15:19:50.436532,0 days 00:00:00.425678,4,2,threshold,0.7298179625095805,5.4190607146538605,COMPLETE
497,12.948212085456005,2026-04-03 15:19:50.436670,2026-04-03 15:19:50.853673,0 days 00:00:00.417003,4,2,logistic,0.7204270237109026,6.3481222647666025,COMPLETE
498,13.577848510305863,2026-04-03 15:19:50.853794,2026-04-03 15:19:51.267874,0 days 00:00:00.414080,4,2,threshold,0.7430412917198566,5.659907189816595,COMPLETE
499,13.577848510305863,2026-04-03 15:19:51.267996,2026-04-03 15:19:51.726956,0 days 00:00:00.458960,4,2,logistic,0.7348417793368148,5.2871805253467805,COMPLETE
500,12.965532642733175,2026-04-03 15:19:51.727076,2026-04-03 15:19:52.143610,0 days 00:00:00.416534,4,2,threshold,0.7632906266347803,5.97016575963752,COMPLETE
501,12.965532642733175,2026-04-03 15:19:52.143734,2026-04-03 15:19:52.557458,0 days 00:00:00.413724,4,2,threshold,0.7525506344366285,5.131334883817036,COMPLETE
502,12.965532642733175,2026-04-03 15:19:52.557587,2026-04-03 15:19:52.972552,0 days 00:00:00.414965,4,2,logistic,0.7909619450966868,6.719336382451562,COMPLETE
503,13.577848510305863,2026-04-03 15:19:52.972678,2026-04-03 15:19:53.388456,0 days 00:00:00.415778,4,2,threshold,0.7249373519891344,4.91730779728074,COMPLETE
504,12.948212085456005,2026-04-03 15:19:53.388593,2026-04-03 15:19:53.805448,0 days 00:00:00.416855,4,2,threshold,0.7115163000023136,3.86440474898866,COMPLETE
505,13.577848510305863,2026-04-03 15:19:53.805573,2026-04-03 15:19:54.225744,0 days 00:00:00.420171,4,2,logistic,0.742527596575769,5.549143363963488,COMPLETE
506,13.577848510305863,2026-04-03 15:19:54.225866,2026-04-03 15:19:54.639397,0 days 00:00:00.413531,4,2,threshold,0.7355961482884059,6.194507129558189,COMPLETE
507,13.577848510305863,2026-04-03 15:19:54.639532,2026-04-03 15:19:55.094058,0 days 00:00:00.454526,4,2,logistic,0.745848650363321,5.355204531711129,COMPLETE
508,13.577848510305863,2026-04-03 15:19:55.094182,2026-04-03 15:19:55.511747,0 days 00:00:00.417565,4,2,threshold,0.7252485572745875,6.07535477738418,COMPLETE
509,12.948212085456005,2026-04-03 15:19:55.511870,2026-04-03 15:19:55.926691,0 days 00:00:00.414821,4,2,threshold,0.6986019788532841,5.467772994428719,COMPLETE
510,13.577848510305863,2026-04-03 15:19:55.926810,2026-04-03 15:19:56.342158,0 days 00:00:00.415348,4,2,logistic,0.7330262936675586,5.219307637182776,COMPLETE
511,12.965532642733175,2026-04-03 15:19:56.342281,2026-04-03 15:19:56.758580,0 days 00:00:00.416299,4,2,threshold,0.7539993468264241,6.628135939679127,COMPLETE
512,12.928162568324508,2026-04-03 15:19:56.758700,2026-04-03 15:19:57.176444,0 days 00:00:00.417744,4,2,threshold,0.6865990182686762,6.298209959068746,COMPLETE
513,12.948212085456005,2026-04-03 15:19:57.176569,2026-04-03 15:19:57.594380,0 days 00:00:00.417811,4,2,logistic,0.7145690702634895,5.669663038175458,COMPLETE
514,13.577848510305863,2026-04-03 15:19:57.594500,2026-04-03 15:19:58.011772,0 days 00:00:00.417272,4,2,threshold,0.739956757931531,5.869910951732439,COMPLETE
515,13.577848510305863,2026-04-03 15:19:58.011890,2026-04-03 15:19:58.466594,0 days 00:00:00.454704,4,2,logistic,0.7294851062400446,6.497094285111084,COMPLETE
516,12.948212085456005,2026-04-03 15:19:58.466717,2026-04-03 15:19:58.882563,0 days 00:00:00.415846,4,2,threshold,0.7213488464155039,5.54938493967691,COMPLETE
517,13.577848510305863,2026-04-03 15:19:58.882682,2026-04-03 15:19:59.298423,0 days 00:00:00.415741,4,2,threshold,0.7470260486067147,5.386744741466979,COMPLETE
518,13.577848510305863,2026-04-03 15:19:59.298545,2026-04-03 15:19:59.714672,0 days 00:00:00.416127,4,2,logistic,0.7413206713460834,5.260333535255001,COMPLETE
519,13.577848510305863,2026-04-03 15:19:59.714789,2026-04-03 15:20:00.130582,0 days 00:00:00.415793,4,2,threshold,0.7320284308791005,5.050329685851613,COMPLETE
520,12.965532642733175,2026-04-03 15:20:00.130709,2026-04-03 15:20:00.557276,0 days 00:00:00.426567,4,2,threshold,0.7755791527728404,5.7312580686655785,COMPLETE
521,12.965532642733175,2026-04-03 15:20:00.557407,2026-04-03 15:20:00.971586,0 days 00:00:00.414179,4,2,logistic,0.7578908746762093,6.886131091324216,COMPLETE
522,13.577848510305863,2026-04-03 15:20:00.971709,2026-04-03 15:20:01.391637,0 days 00:00:00.419928,4,2,threshold,0.7377304108129417,6.400378853613335,COMPLETE
523,12.948212085456005,2026-04-03 15:20:01.391762,2026-04-03 15:20:01.805142,0 days 00:00:00.413380,4,2,logistic,0.7207864790085335,3.2716712976729663,COMPLETE
524,12.965532642733175,2026-04-03 15:20:01.805259,2026-04-03 15:20:02.262458,0 days 00:00:00.457199,4,2,threshold,0.7481204593036607,5.450064557556935,COMPLETE
525,13.577848510305863,2026-04-03 15:20:02.262578,2026-04-03 15:20:02.680894,0 days 00:00:00.418316,4,2,threshold,0.7289539198288668,6.556026814636797,COMPLETE
526,12.948212085456005,2026-04-03 15:20:02.681016,2026-04-03 15:20:03.100567,0 days 00:00:00.419551,4,2,logistic,0.7097223954058884,7.38809578959601,COMPLETE
527,13.577848510305863,2026-04-03 15:20:03.100693,2026-04-03 15:20:03.528285,0 days 00:00:00.427592,4,2,threshold,0.7388282343747685,6.26277825548468,COMPLETE
528,12.928162568324508,2026-04-03 15:20:03.528409,2026-04-03 15:20:03.944900,0 days 00:00:00.416491,4,2,threshold,0.631588780294858,5.6085556085867765,COMPLETE
529,12.928162568324508,2026-04-03 15:20:03.945023,2026-04-03 15:20:04.359633,0 days 00:00:00.414610,4,2,logistic,0.6624333729890183,5.950070831827585,COMPLETE
530,12.965532642733175,2026-04-03 15:20:04.359755,2026-04-03 15:20:04.773809,0 days 00:00:00.414054,4,2,threshold,0.7513586274312591,5.7920974426088225,COMPLETE
531,13.577848510305863,2026-04-03 15:20:04.773928,2026-04-03 15:20:05.188224,0 days 00:00:00.414296,4,2,logistic,0.728423071661633,5.156056760938768,COMPLETE
532,12.948212085456005,2026-04-03 15:20:05.188345,2026-04-03 15:20:05.644239,0 days 00:00:00.455894,4,2,threshold,0.7171498429162247,5.461299962754007,COMPLETE
533,13.577848510305863,2026-04-03 15:20:05.644361,2026-04-03 15:20:06.059912,0 days 00:00:00.415551,4,2,threshold,0.7449943816570307,5.349180435730792,COMPLETE
534,13.577848510305863,2026-04-03 15:20:06.060041,2026-04-03 15:20:06.477944,0 days 00:00:00.417903,4,2,logistic,0.734014378388548,6.683130593862755,COMPLETE
535,12.928162568324508,2026-04-03 15:20:06.478070,2026-04-03 15:20:06.894538,0 days 00:00:00.416468,4,2,threshold,0.6011479474523714,6.082496590487416,COMPLETE
536,12.965532642733175,2026-04-03 15:20:06.894660,2026-04-03 15:20:07.310521,0 days 00:00:00.415861,4,2,threshold,0.7652622622176788,6.402299534924516,COMPLETE
537,13.577848510305863,2026-04-03 15:20:07.310640,2026-04-03 15:20:07.726348,0 days 00:00:00.415708,4,2,logistic,0.7235289641542608,5.590591977475498,COMPLETE
538,4.621809414351053,2026-04-03 15:20:07.726470,2026-04-03 15:20:08.147393,0 days 00:00:00.420923,6,2,threshold,0.7401356601284017,5.293016248578497,COMPLETE
539,12.965532642733175,2026-04-03 15:20:08.147518,2026-04-03 15:20:08.562699,0 days 00:00:00.415181,4,2,logistic,0.754915966165847,6.523952313892579,COMPLETE
540,13.577848510305863,2026-04-03 15:20:08.562821,2026-04-03 15:20:08.977158,0 days 00:00:00.414337,4,2,threshold,0.7343780583726859,5.531527126072575,COMPLETE
541,13.577848510305863,2026-04-03 15:20:08.977276,2026-04-03 15:20:09.433029,0 days 00:00:00.455753,4,2,threshold,0.7467921926751356,6.213595430939019,COMPLETE
542,13.577848510305863,2026-04-03 15:20:09.433149,2026-04-03 15:20:09.847480,0 days 00:00:00.414331,4,2,logistic,0.7294574001026742,5.737355331708494,COMPLETE
543,7.2137439410583175,2026-04-03 15:20:09.847604,2026-04-03 15:20:10.253609,0 days 00:00:00.406005,3,1,threshold,0.7205671766324878,5.177966966211979,COMPLETE
