number,value,datetime_start,datetime_complete,duration,params_hmm_components,params_hmm_favourable,params_hmm_gate,params_hmm_threshold,params_hmm_train_years,state
544,13.577848510305863,2026-04-03 15:20:10.253727,2026-04-03 15:20:10.669482,0 days 00:00:00.415755,4,2,threshold,0.7422232768258858,5.461536392913873,COMPLETE
545,9.808326768326674,2026-04-03 15:20:10.669605,2026-04-03 15:20:11.090044,0 days 00:00:00.420439,4,2,logistic,0.9361598365799144,5.65666399623532,COMPLETE
546,12.948212085456005,2026-04-03 15:20:11.090176,2026-04-03 15:20:11.547885,0 days 00:00:00.457709,4,2,threshold,0.7066799559682647,5.839505867684476,COMPLETE
547,13.577848510305863,2026-04-03 15:20:11.548005,2026-04-03 15:20:11.966614,0 days 00:00:00.418609,4,2,logistic,0.7358052011277342,5.366069093500849,COMPLETE
548,12.965532642733175,2026-04-03 15:20:11.966772,2026-04-03 15:20:12.382352,0 days 00:00:00.415580,4,2,threshold,0.7590536096026392,4.917827110633676,COMPLETE
549,13.577848510305863,2026-04-03 15:20:12.382469,2026-04-03 15:20:12.796883,0 days 00:00:00.414414,4,2,threshold,0.7275208857162473,6.04099284692185,COMPLETE
550,12.948212085456005,2026-04-03 15:20:12.797003,2026-04-03 15:20:13.254346,0 days 00:00:00.457343,4,2,logistic,0.7148449591353851,5.038323764292531,COMPLETE
551,12.965532642733175,2026-04-03 15:20:13.254469,2026-04-03 15:20:13.668790,0 days 00:00:00.414321,4,2,threshold,0.7503175279952141,6.327967389765768,COMPLETE
552,13.577848510305863,2026-04-03 15:20:13.668908,2026-04-03 15:20:14.084996,0 days 00:00:00.416088,4,2,threshold,0.7399041212423091,6.627072510167093,COMPLETE
553,13.577848510305863,2026-04-03 15:20:14.085119,2026-04-03 15:20:14.500484,0 days 00:00:00.415365,4,2,logistic,0.7236619879196244,5.200439237731455,COMPLETE
554,13.577848510305863,2026-04-03 15:20:14.500605,2026-04-03 15:20:14.915182,0 days 00:00:00.414577,4,2,threshold,0.7345808363673849,6.165645762574381,COMPLETE
555,12.965532642733175,2026-04-03 15:20:14.915303,2026-04-03 15:20:15.336216,0 days 00:00:00.420913,4,2,logistic,0.7478139858564362,6.805187494166505,COMPLETE
556,13.577848510305863,2026-04-03 15:20:15.336366,2026-04-03 15:20:15.750885,0 days 00:00:00.414519,4,2,threshold,0.7297432400126891,5.284233196795208,COMPLETE
557,13.577848510305863,2026-04-03 15:20:15.751008,2026-04-03 15:20:16.205917,0 days 00:00:00.454909,4,2,threshold,0.7407606937261763,6.468253411647146,COMPLETE
558,12.965532642733175,2026-04-03 15:20:16.206119,2026-04-03 15:20:16.723862,0 days 00:00:00.517743,4,2,logistic,0.7553299852348706,5.571774720187126,COMPLETE
559,12.948212085456005,2026-04-03 15:20:16.724014,2026-04-03 15:20:17.182250,0 days 00:00:00.458236,4,2,threshold,0.7187710755332627,5.681908449950213,COMPLETE
560,13.577848510305863,2026-04-03 15:20:17.182377,2026-04-03 15:20:17.600748,0 days 00:00:00.418371,4,2,threshold,0.745441032301698,5.43370766186941,COMPLETE
561,12.965532642733175,2026-04-03 15:20:17.600872,2026-04-03 15:20:18.017438,0 days 00:00:00.416566,4,2,logistic,0.7647739746406322,6.379907022476034,COMPLETE
562,2.6267423900416906,2026-04-03 15:20:18.017562,2026-04-03 15:20:18.494312,0 days 00:00:00.476750,5,2,threshold,0.7325583062385537,5.892222892042062,COMPLETE
563,12.948212085456005,2026-04-03 15:20:18.494481,2026-04-03 15:20:18.936834,0 days 00:00:00.442353,4,2,logistic,0.7001558940781878,4.181485613229443,COMPLETE
564,13.577848510305863,2026-04-03 15:20:18.936956,2026-04-03 15:20:19.352394,0 days 00:00:00.415438,4,2,threshold,0.72454034906335,5.113824987092268,COMPLETE
565,13.577848510305863,2026-04-03 15:20:19.352518,2026-04-03 15:20:19.770218,0 days 00:00:00.417700,4,2,threshold,0.7381024308333208,5.520873737073891,COMPLETE
566,12.948212085456005,2026-04-03 15:20:19.770337,2026-04-03 15:20:20.187275,0 days 00:00:00.416938,4,2,logistic,0.7126587404427931,6.56120888111176,COMPLETE
567,12.965532642733175,2026-04-03 15:20:20.187400,2026-04-03 15:20:20.644260,0 days 00:00:00.456860,4,2,threshold,0.7518551938747979,5.351558665125803,COMPLETE
568,13.577848510305863,2026-04-03 15:20:20.644379,2026-04-03 15:20:21.067664,0 days 00:00:00.423285,4,2,threshold,0.7282990905137326,6.717564240809719,COMPLETE
569,10.037786974955102,2026-04-03 15:20:21.067782,2026-04-03 15:20:21.484199,0 days 00:00:00.416417,4,2,logistic,0.9034048822772862,5.968601992478412,COMPLETE
570,13.577848510305863,2026-04-03 15:20:21.484320,2026-04-03 15:20:21.899236,0 days 00:00:00.414916,4,2,threshold,0.7443158561606074,5.2524365133752795,COMPLETE
571,13.577848510305863,2026-04-03 15:20:21.899355,2026-04-03 15:20:22.315564,0 days 00:00:00.416209,4,2,logistic,0.7356138723096275,5.604090644015952,COMPLETE
572,12.948212085456005,2026-04-03 15:20:22.315693,2026-04-03 15:20:22.730514,0 days 00:00:00.414821,4,2,threshold,0.7217921867140981,5.774515317362589,COMPLETE
573,12.965532642733175,2026-04-03 15:20:22.730635,2026-04-03 15:20:23.145395,0 days 00:00:00.414760,4,2,threshold,0.8220823187821468,6.224402369396678,COMPLETE
574,12.965532642733175,2026-04-03 15:20:23.145516,2026-04-03 15:20:23.560909,0 days 00:00:00.415393,4,2,logistic,0.7568380044805525,5.453928831698194,COMPLETE
575,13.577848510305863,2026-04-03 15:20:23.561029,2026-04-03 15:20:23.976583,0 days 00:00:00.415554,4,2,threshold,0.7407912481047266,6.458300429713932,COMPLETE
576,13.577848510305863,2026-04-03 15:20:23.976703,2026-04-03 15:20:24.434058,0 days 00:00:00.457355,4,2,threshold,0.7299256399684712,5.385876733745436,COMPLETE
577,12.965532642733175,2026-04-03 15:20:24.434185,2026-04-03 15:20:24.850249,0 days 00:00:00.416064,4,2,logistic,0.750626126198784,6.608243602766777,COMPLETE
578,13.577848510305863,2026-04-03 15:20:24.850369,2026-04-03 15:20:25.267336,0 days 00:00:00.416967,4,2,threshold,0.73503253400425,5.712896636801124,COMPLETE
579,12.948212085456005,2026-04-03 15:20:25.267459,2026-04-03 15:20:25.682313,0 days 00:00:00.414854,4,2,logistic,0.7162392472626531,5.512629746501313,COMPLETE
580,13.577848510305863,2026-04-03 15:20:25.682436,2026-04-03 15:20:26.095750,0 days 00:00:00.413314,4,2,threshold,0.7456905427086576,6.284900601285801,COMPLETE
581,12.965532642733175,2026-04-03 15:20:26.095872,2026-04-03 15:20:26.515206,0 days 00:00:00.419334,4,2,threshold,0.7833101142060376,6.142309757123927,COMPLETE
582,12.965532642733175,2026-04-03 15:20:26.515335,2026-04-03 15:20:26.930237,0 days 00:00:00.414902,4,2,logistic,0.7709205038731717,5.235459510557184,COMPLETE
583,13.577848510305863,2026-04-03 15:20:26.930354,2026-04-03 15:20:27.348527,0 days 00:00:00.418173,4,2,threshold,0.726172213661083,5.049277795005413,COMPLETE
584,13.577848510305863,2026-04-03 15:20:27.348643,2026-04-03 15:20:27.820929,0 days 00:00:00.472286,4,2,threshold,0.7369750460392718,5.600954439548175,COMPLETE
585,13.577848510305863,2026-04-03 15:20:27.821072,2026-04-03 15:20:28.237756,0 days 00:00:00.416684,4,2,logistic,0.7437367398498214,5.343605077265182,COMPLETE
586,7.2137439410583175,2026-04-03 15:20:28.237874,2026-04-03 15:20:28.642178,0 days 00:00:00.404304,3,1,threshold,0.7077810330031576,6.0290042652730795,COMPLETE
587,13.577848510305863,2026-04-03 15:20:28.642295,2026-04-03 15:20:29.057001,0 days 00:00:00.414706,4,2,logistic,0.7309820014970667,6.384002155414972,COMPLETE
588,13.577848510305863,2026-04-03 15:20:29.057123,2026-04-03 15:20:29.473722,0 days 00:00:00.416599,4,2,threshold,0.7228371421966242,5.873948902468788,COMPLETE
589,12.928162568324508,2026-04-03 15:20:29.473844,2026-04-03 15:20:29.889772,0 days 00:00:00.415928,4,2,threshold,0.6444681381508445,5.137897391437448,COMPLETE
590,12.965532642733175,2026-04-03 15:20:29.889896,2026-04-03 15:20:30.306645,0 days 00:00:00.416749,4,2,logistic,0.7611755050038628,6.509444330283014,COMPLETE
591,12.965532642733175,2026-04-03 15:20:30.306770,2026-04-03 15:20:30.721522,0 days 00:00:00.414752,4,2,threshold,0.7521963169780657,5.663379311960874,COMPLETE
592,13.577848510305863,2026-04-03 15:20:30.721642,2026-04-03 15:20:31.137975,0 days 00:00:00.416333,4,2,threshold,0.7403451819133768,5.493815962544212,COMPLETE
593,13.577848510305863,2026-04-03 15:20:31.138114,2026-04-03 15:20:31.556206,0 days 00:00:00.418092,4,2,logistic,0.7326741824941387,7.596946589232125,COMPLETE
594,12.948212085456005,2026-04-03 15:20:31.556330,2026-04-03 15:20:32.015686,0 days 00:00:00.459356,4,2,threshold,0.7176251991353114,4.845463787982643,COMPLETE
595,13.577848510305863,2026-04-03 15:20:32.015810,2026-04-03 15:20:32.432512,0 days 00:00:00.416702,4,2,logistic,0.7427173753717927,5.298614622546704,COMPLETE
596,13.577848510305863,2026-04-03 15:20:32.432633,2026-04-03 15:20:32.847879,0 days 00:00:00.415246,4,2,threshold,0.725831044048928,4.981497806356096,COMPLETE
597,12.965532642733175,2026-04-03 15:20:32.848004,2026-04-03 15:20:33.264559,0 days 00:00:00.416555,4,2,threshold,0.7508650250753475,6.6259396628409695,COMPLETE
598,13.577848510305863,2026-04-03 15:20:33.264701,2026-04-03 15:20:33.681787,0 days 00:00:00.417086,4,2,logistic,0.7360603822005319,5.79405772318805,COMPLETE
599,12.948212085456005,2026-04-03 15:20:33.681905,2026-04-03 15:20:34.099583,0 days 00:00:00.417678,4,2,threshold,0.7130343204741207,5.571580533168906,COMPLETE
600,13.577848510305863,2026-04-03 15:20:34.099708,2026-04-03 15:20:34.518648,0 days 00:00:00.418940,4,2,threshold,0.7467105730391548,5.413710803783817,COMPLETE
601,13.577848510305863,2026-04-03 15:20:34.518768,2026-04-03 15:20:34.934012,0 days 00:00:00.415244,4,2,logistic,0.7306301303329262,3.727087233152652,COMPLETE
602,12.965532642733175,2026-04-03 15:20:34.934130,2026-04-03 15:20:35.355748,0 days 00:00:00.421618,4,2,threshold,0.760188893151563,6.3486878660813755,COMPLETE
603,13.577848510305863,2026-04-03 15:20:35.355870,2026-04-03 15:20:35.813792,0 days 00:00:00.457922,4,2,logistic,0.7376817689161023,6.975231651319992,COMPLETE
604,12.948212085456005,2026-04-03 15:20:35.813912,2026-04-03 15:20:36.232603,0 days 00:00:00.418691,4,2,threshold,0.722122921033648,7.198131995696091,COMPLETE
605,12.623997772725678,2026-04-03 15:20:36.232731,2026-04-03 15:20:36.631852,0 days 00:00:00.399121,2,1,threshold,0.7431853520237751,6.478711483724029,COMPLETE
606,13.577848510305863,2026-04-03 15:20:36.631974,2026-04-03 15:20:37.049191,0 days 00:00:00.417217,4,2,logistic,0.7291006631845016,5.190150594223875,COMPLETE
607,12.965532642733175,2026-04-03 15:20:37.049315,2026-04-03 15:20:37.465051,0 days 00:00:00.415736,4,2,threshold,0.7544555090963199,5.6974435468048705,COMPLETE
608,13.577848510305863,2026-04-03 15:20:37.465173,2026-04-03 15:20:37.881890,0 days 00:00:00.416717,4,2,threshold,0.7336184619019214,6.79346472433189,COMPLETE
609,12.948212085456005,2026-04-03 15:20:37.882008,2026-04-03 15:20:38.295995,0 days 00:00:00.413987,4,2,logistic,0.7219362105505844,6.140544221484719,COMPLETE
610,13.577848510305863,2026-04-03 15:20:38.296115,2026-04-03 15:20:38.713060,0 days 00:00:00.416945,4,2,threshold,0.74485282530393,5.4603580866433115,COMPLETE
611,13.577848510305863,2026-04-03 15:20:38.713184,2026-04-03 15:20:39.127632,0 days 00:00:00.414448,4,2,logistic,0.7377938716386823,6.276969673548063,COMPLETE
612,12.948212085456005,2026-04-03 15:20:39.127750,2026-04-03 15:20:39.596445,0 days 00:00:00.468695,4,2,threshold,0.7037247427946404,6.0033868016324305,COMPLETE
613,12.948212085456005,2026-04-03 15:20:39.596571,2026-04-03 15:20:40.011352,0 days 00:00:00.414781,4,2,threshold,0.7162666817531602,5.314927401654164,COMPLETE
614,12.965532642733175,2026-04-03 15:20:40.011477,2026-04-03 15:20:40.428756,0 days 00:00:00.417279,4,2,logistic,0.7525305791677258,5.538079292185311,COMPLETE
615,13.577848510305863,2026-04-03 15:20:40.428881,2026-04-03 15:20:40.846336,0 days 00:00:00.417455,4,2,threshold,0.7288672927536136,6.673430519445094,COMPLETE
616,13.577848510305863,2026-04-03 15:20:40.846459,2026-04-03 15:20:41.264777,0 days 00:00:00.418318,4,2,threshold,0.7372488175549163,5.628233710583154,COMPLETE
617,2.6267423900416906,2026-04-03 15:20:41.264899,2026-04-03 15:20:41.729901,0 days 00:00:00.465002,5,2,logistic,0.7466455859069342,5.799673354194236,COMPLETE
618,13.577848510305863,2026-04-03 15:20:41.730021,2026-04-03 15:20:42.147031,0 days 00:00:00.417010,4,2,threshold,0.7247700196522425,5.077830844594192,COMPLETE
619,12.965532642733175,2026-04-03 15:20:42.147153,2026-04-03 15:20:42.562122,0 days 00:00:00.414969,4,2,logistic,0.7664706408709075,4.544905519454931,COMPLETE
620,13.577848510305863,2026-04-03 15:20:42.562244,2026-04-03 15:20:43.020665,0 days 00:00:00.458421,4,2,threshold,0.7347145491602415,6.549292153342548,COMPLETE
621,13.577848510305863,2026-04-03 15:20:43.020811,2026-04-03 15:20:43.436123,0 days 00:00:00.415312,4,2,threshold,0.7422947778589427,6.427519393090106,COMPLETE
622,12.948212085456005,2026-04-03 15:20:43.436243,2026-04-03 15:20:43.858346,0 days 00:00:00.422103,4,2,logistic,0.7147433396320224,5.246535330483761,COMPLETE
623,12.965532642733175,2026-04-03 15:20:43.858483,2026-04-03 15:20:44.274216,0 days 00:00:00.415733,4,2,threshold,0.7547886504469344,5.928423821362699,COMPLETE
624,13.577848510305863,2026-04-03 15:20:44.274337,2026-04-03 15:20:44.695912,0 days 00:00:00.421575,4,2,threshold,0.7273171421252519,5.374350450847976,COMPLETE
625,13.577848510305863,2026-04-03 15:20:44.696032,2026-04-03 15:20:45.111322,0 days 00:00:00.415290,4,2,logistic,0.7466687071846663,5.475019886596156,COMPLETE
626,13.577848510305863,2026-04-03 15:20:45.111441,2026-04-03 15:20:45.526889,0 days 00:00:00.415448,4,2,threshold,0.7332011925567375,6.095156054772846,COMPLETE
627,12.948212085456005,2026-04-03 15:20:45.527010,2026-04-03 15:20:45.947191,0 days 00:00:00.420181,4,2,logistic,0.7218815825518838,5.695038295056532,COMPLETE
628,13.577848510305863,2026-04-03 15:20:45.947315,2026-04-03 15:20:46.362590,0 days 00:00:00.415275,4,2,threshold,0.7392601747589777,5.146151311410366,COMPLETE
629,12.965532642733175,2026-04-03 15:20:46.362717,2026-04-03 15:20:46.778419,0 days 00:00:00.415702,4,2,threshold,0.7606068386191275,5.60186695147913,COMPLETE
630,12.965532642733175,2026-04-03 15:20:46.778540,2026-04-03 15:20:47.239350,0 days 00:00:00.460810,4,2,logistic,0.7490403338734896,6.233887186471016,COMPLETE
631,12.948212085456005,2026-04-03 15:20:47.239468,2026-04-03 15:20:47.655611,0 days 00:00:00.416143,4,2,threshold,0.708689613320703,5.397716987552475,COMPLETE
632,13.577848510305863,2026-04-03 15:20:47.655732,2026-04-03 15:20:48.083542,0 days 00:00:00.427810,4,2,threshold,0.729530469093198,4.7473596882314215,COMPLETE
633,13.577848510305863,2026-04-03 15:20:48.083680,2026-04-03 15:20:48.506935,0 days 00:00:00.423255,4,2,logistic,0.7429981512492398,6.40480605466001,COMPLETE
634,12.948212085456005,2026-04-03 15:20:48.507062,2026-04-03 15:20:48.996744,0 days 00:00:00.489682,4,2,threshold,0.7201811417417746,6.583207384015633,COMPLETE
635,13.577848510305863,2026-04-03 15:20:48.996883,2026-04-03 15:20:49.431852,0 days 00:00:00.434969,4,2,logistic,0.7364689537453321,5.295452652144316,COMPLETE
636,13.577848510305863,2026-04-03 15:20:49.431984,2026-04-03 15:20:49.852177,0 days 00:00:00.420193,4,2,threshold,0.7301327026385376,5.510875221394786,COMPLETE
637,12.965532642733175,2026-04-03 15:20:49.852314,2026-04-03 15:20:50.267417,0 days 00:00:00.415103,4,2,threshold,0.7548154128152769,5.85151589636944,COMPLETE
638,13.577848510305863,2026-04-03 15:20:50.267540,2026-04-03 15:20:50.683686,0 days 00:00:00.416146,4,2,logistic,0.7399403094124437,6.745039870010975,COMPLETE
639,13.577848510305863,2026-04-03 15:20:50.683806,2026-04-03 15:20:51.150529,0 days 00:00:00.466723,4,2,threshold,0.723422724719335,4.994886497334846,COMPLETE
640,12.965532642733175,2026-04-03 15:20:51.150659,2026-04-03 15:20:51.567065,0 days 00:00:00.416406,4,2,threshold,0.7477041749105673,5.243364086322724,COMPLETE
641,12.948212085456005,2026-04-03 15:20:51.567195,2026-04-03 15:20:51.984530,0 days 00:00:00.417335,4,2,logistic,0.7121492291452673,5.735071783559259,COMPLETE
642,13.577848510305863,2026-04-03 15:20:51.984657,2026-04-03 15:20:52.401601,0 days 00:00:00.416944,4,2,threshold,0.7330087534012021,5.409813213567948,COMPLETE
643,13.577848510305863,2026-04-03 15:20:52.401719,2026-04-03 15:20:52.818705,0 days 00:00:00.416986,4,2,logistic,0.7418213182282483,7.846257952440848,COMPLETE
644,13.577848510305863,2026-04-03 15:20:52.818831,2026-04-03 15:20:53.237870,0 days 00:00:00.419039,4,2,threshold,0.7266349503374819,6.285868695004409,COMPLETE
645,12.965532642733175,2026-04-03 15:20:53.237993,2026-04-03 15:20:53.677911,0 days 00:00:00.439918,4,2,threshold,0.7603736076914581,5.599221195186318,COMPLETE
646,10.261734682613241,2026-04-03 15:20:53.678084,2026-04-03 15:20:54.098804,0 days 00:00:00.420720,4,2,logistic,0.8772638734395442,6.475819650901571,COMPLETE
647,12.965532642733175,2026-04-03 15:20:54.098945,2026-04-03 15:20:54.519322,0 days 00:00:00.420377,4,2,threshold,0.7504149423231343,5.509267026809795,COMPLETE
648,13.577848510305863,2026-04-03 15:20:54.519446,2026-04-03 15:20:54.985414,0 days 00:00:00.465968,4,2,threshold,0.7356526475252796,5.114780501607212,COMPLETE
649,12.948212085456005,2026-04-03 15:20:54.985540,2026-04-03 15:20:55.401814,0 days 00:00:00.416274,4,2,logistic,0.7168456215940812,4.892088493742496,COMPLETE
650,12.965532642733175,2026-04-03 15:20:55.401941,2026-04-03 15:20:55.839748,0 days 00:00:00.437807,4,2,threshold,0.7721754484968646,6.083236047012483,COMPLETE
651,13.577848510305863,2026-04-03 15:20:55.839896,2026-04-03 15:20:56.278985,0 days 00:00:00.439089,4,2,logistic,0.7405344729497512,5.3396189457721235,COMPLETE
652,13.577848510305863,2026-04-03 15:20:56.279111,2026-04-03 15:20:56.710024,0 days 00:00:00.430913,4,2,threshold,0.7280819763877155,5.645550465784818,COMPLETE
653,12.948212085456005,2026-04-03 15:20:56.710163,2026-04-03 15:20:57.131356,0 days 00:00:00.421193,4,2,threshold,0.7036571231332506,6.376563012267904,COMPLETE
654,12.965532642733175,2026-04-03 15:20:57.131487,2026-04-03 15:20:57.549988,0 days 00:00:00.418501,4,2,logistic,0.7492238461115028,5.942339568107993,COMPLETE
655,13.577848510305863,2026-04-03 15:20:57.550122,2026-04-03 15:20:57.971497,0 days 00:00:00.421375,4,2,threshold,0.7334476181561889,6.6578430674073426,COMPLETE
656,12.948212085456005,2026-04-03 15:20:57.971622,2026-04-03 15:20:58.438491,0 days 00:00:00.466869,4,2,threshold,0.7196336605679096,5.752302870580204,COMPLETE
657,12.928162568324508,2026-04-03 15:20:58.438621,2026-04-03 15:20:58.863648,0 days 00:00:00.425027,4,2,logistic,0.673999098759283,6.1848878894222725,COMPLETE
658,13.577848510305863,2026-04-03 15:20:58.863787,2026-04-03 15:20:59.298289,0 days 00:00:00.434502,4,2,threshold,0.7423045851711166,5.215936255868364,COMPLETE
659,13.577848510305863,2026-04-03 15:20:59.298420,2026-04-03 15:20:59.727091,0 days 00:00:00.428671,4,2,logistic,0.7252541256190806,5.432005330817129,COMPLETE
660,12.965532642733175,2026-04-03 15:20:59.727218,2026-04-03 15:21:00.146542,0 days 00:00:00.419324,4,2,threshold,0.7540112249908034,6.555228839606046,COMPLETE
661,13.577848510305863,2026-04-03 15:21:00.146666,2026-04-03 15:21:00.569625,0 days 00:00:00.422959,4,2,threshold,0.7357135576102385,5.528182566522019,COMPLETE
662,13.577848510305863,2026-04-03 15:21:00.569754,2026-04-03 15:21:00.992251,0 days 00:00:00.422497,4,2,logistic,0.7463720593538189,6.318796357799625,COMPLETE
663,13.577848510305863,2026-04-03 15:21:00.992378,2026-04-03 15:21:01.423317,0 days 00:00:00.430939,4,2,threshold,0.7307104907704629,5.813052302483746,COMPLETE
664,13.577848510305863,2026-04-03 15:21:01.423592,2026-04-03 15:21:01.848659,0 days 00:00:00.425067,4,2,threshold,0.7403012162691304,5.1689407502773435,COMPLETE
665,12.948212085456005,2026-04-03 15:21:01.848788,2026-04-03 15:21:02.280878,0 days 00:00:00.432090,4,2,logistic,0.7120357367058896,5.3047829764244065,COMPLETE
666,12.928162568324508,2026-04-03 15:21:02.281004,2026-04-03 15:21:02.751642,0 days 00:00:00.470638,4,2,threshold,0.6955435550139453,6.472034311188812,COMPLETE
667,13.577848510305863,2026-04-03 15:21:02.751766,2026-04-03 15:21:03.171901,0 days 00:00:00.420135,4,2,logistic,0.7225063512352774,6.014283316799451,COMPLETE
668,12.965532642733175,2026-04-03 15:21:03.172032,2026-04-03 15:21:03.601802,0 days 00:00:00.429770,4,2,threshold,0.7602025177667203,5.630123744514867,COMPLETE
669,13.577848510305863,2026-04-03 15:21:03.601935,2026-04-03 15:21:04.029039,0 days 00:00:00.427104,4,2,threshold,0.7321341699345739,6.89090668730454,COMPLETE
670,12.965532642733175,2026-04-03 15:21:04.029166,2026-04-03 15:21:04.465330,0 days 00:00:00.436164,4,2,logistic,0.7486348003298898,5.387367941666768,COMPLETE
671,13.577848510305863,2026-04-03 15:21:04.465460,2026-04-03 15:21:04.882205,0 days 00:00:00.416745,4,2,threshold,0.7382065644411241,5.567289488033946,COMPLETE
672,12.948212085456005,2026-04-03 15:21:04.882327,2026-04-03 15:21:05.299260,0 days 00:00:00.416933,4,2,threshold,0.7181340939320989,5.454888341551723,COMPLETE
673,12.928162568324508,2026-04-03 15:21:05.299384,2026-04-03 15:21:05.717098,0 days 00:00:00.417714,4,2,logistic,0.6880130238018647,5.0871503844942705,COMPLETE
674,13.577848510305863,2026-04-03 15:21:05.717224,2026-04-03 15:21:06.142266,0 days 00:00:00.425042,4,2,threshold,0.7290917331020624,6.718479469081987,COMPLETE
675,12.965532642733175,2026-04-03 15:21:06.142397,2026-04-03 15:21:06.607825,0 days 00:00:00.465428,4,2,logistic,0.7555205165083699,5.907996909979445,COMPLETE
676,13.577848510305863,2026-04-03 15:21:06.607962,2026-04-03 15:21:07.023653,0 days 00:00:00.415691,4,2,threshold,0.7416444279447109,5.270708032628141,COMPLETE
677,13.577848510305863,2026-04-03 15:21:07.023777,2026-04-03 15:21:07.438689,0 days 00:00:00.414912,4,2,threshold,0.7230467017307293,5.734687204290338,COMPLETE
678,3.630248441834585,2026-04-03 15:21:07.438809,2026-04-03 15:21:07.864892,0 days 00:00:00.426083,6,3,logistic,0.7666191250227966,6.172670578091008,COMPLETE
679,13.577848510305863,2026-04-03 15:21:07.865016,2026-04-03 15:21:08.280772,0 days 00:00:00.415756,4,2,threshold,0.7460163151382069,6.564962976864243,COMPLETE
