number,value,datetime_start,datetime_complete,duration,params_hmm_components,params_hmm_favourable,params_hmm_gate,params_hmm_threshold,params_hmm_train_years,state
272,12.948212085456005,2026-04-03 15:18:11.155222,2026-04-03 15:18:11.568496,0 days 00:00:00.413274,4,2,threshold,0.7126648820739363,5.296051711060225,COMPLETE
273,13.577848510305863,2026-04-03 15:18:11.568617,2026-04-03 15:18:11.979994,0 days 00:00:00.411377,4,2,logistic,0.7312933502372533,5.139368166843177,COMPLETE
274,12.928162568324508,2026-04-03 15:18:11.980114,2026-04-03 15:18:12.392718,0 days 00:00:00.412604,4,2,threshold,0.646654520956204,5.544641483984368,COMPLETE
275,13.577848510305863,2026-04-03 15:18:12.392837,2026-04-03 15:18:12.806648,0 days 00:00:00.413811,4,2,logistic,0.7238171126407068,5.977168077180422,COMPLETE
276,13.577848510305863,2026-04-03 15:18:12.806776,2026-04-03 15:18:13.254160,0 days 00:00:00.447384,4,2,threshold,0.7427443916213221,4.049051459909736,COMPLETE
277,12.965532642733175,2026-04-03 15:18:13.254294,2026-04-03 15:18:13.664334,0 days 00:00:00.410040,4,2,threshold,0.755615643641385,7.5425422333308,COMPLETE
278,13.577848510305863,2026-04-03 15:18:13.664456,2026-04-03 15:18:14.079910,0 days 00:00:00.415454,4,2,logistic,0.7356368705751941,6.130633279242312,COMPLETE
279,13.577848510305863,2026-04-03 15:18:14.080041,2026-04-03 15:18:14.492803,0 days 00:00:00.412762,4,2,threshold,0.7465164712694421,5.352936021489174,COMPLETE
280,12.948212085456005,2026-04-03 15:18:14.492921,2026-04-03 15:18:14.907258,0 days 00:00:00.414337,4,2,threshold,0.7065762741665075,5.039840210645477,COMPLETE
281,13.577848510305863,2026-04-03 15:18:14.907380,2026-04-03 15:18:15.325729,0 days 00:00:00.418349,4,2,logistic,0.7291876160497092,5.7531202763453315,COMPLETE
282,12.965532642733175,2026-04-03 15:18:15.325851,2026-04-03 15:18:15.736273,0 days 00:00:00.410422,4,2,threshold,0.7600967825742491,6.333098944597596,COMPLETE
283,12.948212085456005,2026-04-03 15:18:15.736392,2026-04-03 15:18:16.150568,0 days 00:00:00.414176,4,2,logistic,0.7172768770524491,5.426366571395487,COMPLETE
284,13.577848510305863,2026-04-03 15:18:16.150689,2026-04-03 15:18:16.602125,0 days 00:00:00.451436,4,2,threshold,0.7392899300640792,5.663508317082516,COMPLETE
285,13.577848510305863,2026-04-03 15:18:16.602252,2026-04-03 15:18:17.016362,0 days 00:00:00.414110,4,2,threshold,0.7282561955267832,6.4724504767549424,COMPLETE
286,12.965532642733175,2026-04-03 15:18:17.016482,2026-04-03 15:18:17.427996,0 days 00:00:00.411514,4,2,logistic,0.7502064991046739,6.230895009306877,COMPLETE
287,13.577848510305863,2026-04-03 15:18:17.428119,2026-04-03 15:18:17.839822,0 days 00:00:00.411703,4,2,threshold,0.7375009783770345,4.914702070253562,COMPLETE
288,12.948212085456005,2026-04-03 15:18:17.839940,2026-04-03 15:18:18.254180,0 days 00:00:00.414240,4,2,threshold,0.7211651483197005,6.61451915376609,COMPLETE
289,13.577848510305863,2026-04-03 15:18:18.254313,2026-04-03 15:18:18.665026,0 days 00:00:00.410713,4,2,logistic,0.7442907338106182,5.259018958318891,COMPLETE
290,13.577848510305863,2026-04-03 15:18:18.665148,2026-04-03 15:18:19.076188,0 days 00:00:00.411040,4,2,threshold,0.7335187425170226,5.471674449136418,COMPLETE
291,13.577848510305863,2026-04-03 15:18:19.076310,2026-04-03 15:18:19.523930,0 days 00:00:00.447620,4,2,logistic,0.7251988033970214,5.8402712002146275,COMPLETE
292,12.965532642733175,2026-04-03 15:18:19.524059,2026-04-03 15:18:19.945238,0 days 00:00:00.421179,4,2,threshold,0.7521607476511527,5.60308108338559,COMPLETE
293,13.577848510305863,2026-04-03 15:18:19.945366,2026-04-03 15:18:20.357157,0 days 00:00:00.411791,4,2,threshold,0.7338795302012319,6.8147460637338435,COMPLETE
294,13.577848510305863,2026-04-03 15:18:20.357277,2026-04-03 15:18:20.770228,0 days 00:00:00.412951,4,2,logistic,0.7419242078636703,6.05622923864256,COMPLETE
295,12.948212085456005,2026-04-03 15:18:20.770349,2026-04-03 15:18:21.183247,0 days 00:00:00.412898,4,2,threshold,0.7144065020703562,5.347756277241449,COMPLETE
296,13.577848510305863,2026-04-03 15:18:21.183369,2026-04-03 15:18:21.629627,0 days 00:00:00.446258,4,2,threshold,0.7295754778231066,5.1143168036520255,COMPLETE
297,12.965532642733175,2026-04-03 15:18:21.629777,2026-04-03 15:18:22.082320,0 days 00:00:00.452543,4,2,logistic,0.7626894370555742,6.39711141010834,COMPLETE
298,12.965532642733175,2026-04-03 15:18:22.082473,2026-04-03 15:18:22.569967,0 days 00:00:00.487494,4,2,threshold,0.7484512727501582,5.193906823444548,COMPLETE
299,13.577848510305863,2026-04-03 15:18:22.570091,2026-04-03 15:18:22.983965,0 days 00:00:00.413874,4,2,logistic,0.7391900043647988,7.965098894968009,COMPLETE
300,3.630248441834585,2026-04-03 15:18:22.984087,2026-04-03 15:18:23.408188,0 days 00:00:00.424101,6,3,threshold,0.7023369192779068,6.696665890882511,COMPLETE
301,10.180158691659003,2026-04-03 15:18:23.408308,2026-04-03 15:18:23.826191,0 days 00:00:00.417883,4,2,threshold,0.9300157952157309,5.5451583458367875,COMPLETE
302,12.948212085456005,2026-04-03 15:18:23.826340,2026-04-03 15:18:24.392066,0 days 00:00:00.565726,4,2,logistic,0.720900388606173,6.543078942630661,COMPLETE
303,13.577848510305863,2026-04-03 15:18:24.392246,2026-04-03 15:18:25.213417,0 days 00:00:00.821171,4,2,threshold,0.7293977769247681,5.952075443081235,COMPLETE
304,12.965532642733175,2026-04-03 15:18:25.214165,2026-04-03 15:18:25.644856,0 days 00:00:00.430691,4,2,threshold,0.7561936471688956,5.439408706751957,COMPLETE
305,12.965532642733175,2026-04-03 15:18:25.645032,2026-04-03 15:18:26.069225,0 days 00:00:00.424193,4,2,logistic,0.7693145675913378,5.690274446899643,COMPLETE
306,13.577848510305863,2026-04-03 15:18:26.069361,2026-04-03 15:18:26.567507,0 days 00:00:00.498146,4,2,threshold,0.7443425784075317,6.27967082287823,COMPLETE
307,13.577848510305863,2026-04-03 15:18:26.567627,2026-04-03 15:18:27.129209,0 days 00:00:00.561582,4,2,logistic,0.7362083769424442,5.304944678989664,COMPLETE
308,12.948212085456005,2026-04-03 15:18:27.129369,2026-04-03 15:18:27.667973,0 days 00:00:00.538604,4,2,threshold,0.7116019556555858,6.145722056628806,COMPLETE
309,13.577848510305863,2026-04-03 15:18:27.668103,2026-04-03 15:18:28.181123,0 days 00:00:00.513020,4,2,threshold,0.724290493134441,5.795971839239415,COMPLETE
310,12.965532642733175,2026-04-03 15:18:28.181255,2026-04-03 15:18:28.710828,0 days 00:00:00.529573,4,2,logistic,0.748887207407813,5.559517189980562,COMPLETE
311,13.577848510305863,2026-04-03 15:18:28.710987,2026-04-03 15:18:29.156379,0 days 00:00:00.445392,4,2,threshold,0.7373908661297408,5.008328773979687,COMPLETE
312,3.4856152817995465,2026-04-03 15:18:29.156513,2026-04-03 15:18:29.575462,0 days 00:00:00.418949,4,1,threshold,0.7305266435156283,5.389442458459801,COMPLETE
313,12.948212085456005,2026-04-03 15:18:29.575606,2026-04-03 15:18:30.008987,0 days 00:00:00.433381,4,2,logistic,0.7191893211994822,6.4164570166627835,COMPLETE
314,13.577848510305863,2026-04-03 15:18:30.009124,2026-04-03 15:18:30.480223,0 days 00:00:00.471099,4,2,threshold,0.7445789782019847,5.619940766363598,COMPLETE
315,12.965532642733175,2026-04-03 15:18:30.480354,2026-04-03 15:18:30.912947,0 days 00:00:00.432593,4,2,logistic,0.7567732276281898,5.474705496472799,COMPLETE
316,13.577848510305863,2026-04-03 15:18:30.913129,2026-04-03 15:18:31.355991,0 days 00:00:00.442862,4,2,threshold,0.7376860882698111,5.255161331444219,COMPLETE
317,13.577848510305863,2026-04-03 15:18:31.356125,2026-04-03 15:18:31.791992,0 days 00:00:00.435867,4,2,threshold,0.7269602320891996,6.624270672813682,COMPLETE
318,12.965532642733175,2026-04-03 15:18:31.792133,2026-04-03 15:18:32.778454,0 days 00:00:00.986321,4,2,logistic,0.7495819233022636,5.902078714336274,COMPLETE
319,12.797069396644059,2026-04-03 15:18:32.778708,2026-04-03 15:18:33.297945,0 days 00:00:00.519237,4,2,threshold,0.8686446341758418,6.545290912139043,COMPLETE
320,13.577848510305863,2026-04-03 15:18:33.298322,2026-04-03 15:18:33.764044,0 days 00:00:00.465722,4,2,threshold,0.7411873464333006,5.691911782747922,COMPLETE
321,13.577848510305863,2026-04-03 15:18:33.764179,2026-04-03 15:18:34.264113,0 days 00:00:00.499934,4,2,logistic,0.7333396084124587,4.836673390799326,COMPLETE
322,12.948212085456005,2026-04-03 15:18:34.264256,2026-04-03 15:18:34.770622,0 days 00:00:00.506366,4,2,threshold,0.7199396411318695,6.297973251462485,COMPLETE
323,13.577848510305863,2026-04-03 15:18:34.770750,2026-04-03 15:18:35.413353,0 days 00:00:00.642603,4,2,logistic,0.7300716580851362,5.184914432229313,COMPLETE
324,12.948212085456005,2026-04-03 15:18:35.413492,2026-04-03 15:18:35.833819,0 days 00:00:00.420327,4,2,threshold,0.7109450088247311,6.933982835136093,COMPLETE
325,13.577848510305863,2026-04-03 15:18:35.833938,2026-04-03 15:18:36.254616,0 days 00:00:00.420678,4,2,threshold,0.7451004826588143,5.331163788321944,COMPLETE
326,13.577848510305863,2026-04-03 15:18:36.254736,2026-04-03 15:18:36.672400,0 days 00:00:00.417664,4,2,logistic,0.7349781128935668,6.47962759101,COMPLETE
327,12.965532642733175,2026-04-03 15:18:36.672519,2026-04-03 15:18:37.088146,0 days 00:00:00.415627,4,2,threshold,0.756445908952797,5.517569982251426,COMPLETE
328,12.965532642733175,2026-04-03 15:18:37.088272,2026-04-03 15:18:37.505440,0 days 00:00:00.417168,4,2,threshold,0.7964018174384835,3.2950034434425017,COMPLETE
329,13.577848510305863,2026-04-03 15:18:37.505572,2026-04-03 15:18:37.919680,0 days 00:00:00.414108,4,2,logistic,0.7255646693127087,5.092400140438759,COMPLETE
330,13.577848510305863,2026-04-03 15:18:37.919798,2026-04-03 15:18:38.378887,0 days 00:00:00.459089,4,2,threshold,0.7427114890209816,5.760276077209287,COMPLETE
331,12.965532642733175,2026-04-03 15:18:38.379007,2026-04-03 15:18:38.798471,0 days 00:00:00.419464,4,2,logistic,0.7520446549739112,6.069948390016268,COMPLETE
332,12.948212085456005,2026-04-03 15:18:38.798592,2026-04-03 15:18:39.328103,0 days 00:00:00.529511,4,2,threshold,0.7199777188169614,5.420238972615999,COMPLETE
333,12.965532642733175,2026-04-03 15:18:39.328255,2026-04-03 15:18:39.842498,0 days 00:00:00.514243,4,2,threshold,0.7630295317454282,5.584630807035697,COMPLETE
334,13.577848510305863,2026-04-03 15:18:39.842621,2026-04-03 15:18:40.263174,0 days 00:00:00.420553,4,2,logistic,0.7337349759629752,6.153144074188106,COMPLETE
335,13.577848510305863,2026-04-03 15:18:40.263295,2026-04-03 15:18:40.678277,0 days 00:00:00.414982,4,2,threshold,0.7420473974645162,6.356670098712722,COMPLETE
336,12.928162568324508,2026-04-03 15:18:40.678407,2026-04-03 15:18:41.097827,0 days 00:00:00.419420,4,2,threshold,0.66803300668247,5.243993594486933,COMPLETE
337,13.577848510305863,2026-04-03 15:18:41.097955,2026-04-03 15:18:41.520956,0 days 00:00:00.423001,4,2,logistic,0.7278199221374364,6.698005006585678,COMPLETE
338,12.965532642733175,2026-04-03 15:18:41.521078,2026-04-03 15:18:42.045256,0 days 00:00:00.524178,4,2,threshold,0.7510556229831767,5.854906281945705,COMPLETE
339,12.948212085456005,2026-04-03 15:18:42.045378,2026-04-03 15:18:43.247444,0 days 00:00:01.202066,4,2,logistic,0.7021038737051613,5.661461439682829,COMPLETE
340,13.577848510305863,2026-04-03 15:18:43.247569,2026-04-03 15:18:43.693479,0 days 00:00:00.445910,4,2,threshold,0.738634832676881,5.380191374111762,COMPLETE
341,12.948212085456005,2026-04-03 15:18:43.693611,2026-04-03 15:18:44.125100,0 days 00:00:00.431489,4,2,threshold,0.7129728844505023,5.974570593171171,COMPLETE
342,12.965532642733175,2026-04-03 15:18:44.125224,2026-04-03 15:18:44.666858,0 days 00:00:00.541634,4,2,logistic,0.7736894687895417,4.965297545291231,COMPLETE
343,13.577848510305863,2026-04-03 15:18:44.667000,2026-04-03 15:18:45.096100,0 days 00:00:00.429100,4,2,threshold,0.7229999874347726,5.486744224865028,COMPLETE
344,13.577848510305863,2026-04-03 15:18:45.096219,2026-04-03 15:18:45.514083,0 days 00:00:00.417864,4,2,threshold,0.732637846373784,6.471743421735078,COMPLETE
345,12.928162568324508,2026-04-03 15:18:45.514205,2026-04-03 15:18:45.934042,0 days 00:00:00.419837,4,2,logistic,0.6923977771889916,6.227258570682559,COMPLETE
346,13.577848510305863,2026-04-03 15:18:45.934170,2026-04-03 15:18:46.390264,0 days 00:00:00.456094,4,2,threshold,0.7467498736138584,5.1121421580278525,COMPLETE
347,13.577848510305863,2026-04-03 15:18:46.390384,2026-04-03 15:18:46.817269,0 days 00:00:00.426885,4,2,logistic,0.7379120729596264,5.311601920440551,COMPLETE
348,12.948212085456005,2026-04-03 15:18:46.817389,2026-04-03 15:18:47.232637,0 days 00:00:00.415248,4,2,threshold,0.7166347415805532,6.780856059473396,COMPLETE
349,13.577848510305863,2026-04-03 15:18:47.232757,2026-04-03 15:18:47.649797,0 days 00:00:00.417040,4,2,threshold,0.7279865266449713,6.591178201816971,COMPLETE
350,12.965532642733175,2026-04-03 15:18:47.649915,2026-04-03 15:18:48.068950,0 days 00:00:00.419035,4,2,logistic,0.7602127805413018,5.725338981697328,COMPLETE
351,13.577848510305863,2026-04-03 15:18:48.069071,2026-04-03 15:18:48.484264,0 days 00:00:00.415193,4,2,threshold,0.7459202126003821,5.556988592423737,COMPLETE
352,12.623997772725678,2026-04-03 15:18:48.484386,2026-04-03 15:18:48.885494,0 days 00:00:00.401108,2,1,threshold,0.7374911724720339,5.432520830029783,COMPLETE
353,13.577848510305863,2026-04-03 15:18:48.885617,2026-04-03 15:18:49.302776,0 days 00:00:00.417159,4,2,logistic,0.7271343658476312,6.368726496498109,COMPLETE
354,12.965532642733175,2026-04-03 15:18:49.302899,2026-04-03 15:18:49.754875,0 days 00:00:00.451976,4,2,threshold,0.7521153867410286,5.6454084198060785,COMPLETE
355,13.577848510305863,2026-04-03 15:18:49.754994,2026-04-03 15:18:50.171876,0 days 00:00:00.416882,4,2,logistic,0.7410860574788574,5.21135391815076,COMPLETE
356,12.948212085456005,2026-04-03 15:18:50.171996,2026-04-03 15:18:50.584482,0 days 00:00:00.412486,4,2,threshold,0.7201202390177056,6.518080523682826,COMPLETE
357,13.577848510305863,2026-04-03 15:18:50.584601,2026-04-03 15:18:50.998014,0 days 00:00:00.413413,4,2,threshold,0.7317772954461439,5.836312329029216,COMPLETE
358,12.965532642733175,2026-04-03 15:18:50.998136,2026-04-03 15:18:51.414840,0 days 00:00:00.416704,4,2,logistic,0.7845418799272738,6.061856922658428,COMPLETE
359,13.577848510305863,2026-04-03 15:18:51.414961,2026-04-03 15:18:51.838961,0 days 00:00:00.424000,4,2,threshold,0.7461481056809469,5.342244246402038,COMPLETE
360,13.577848510305863,2026-04-03 15:18:51.839080,2026-04-03 15:18:52.254313,0 days 00:00:00.415233,4,2,threshold,0.7333254196148266,5.508703276070348,COMPLETE
361,12.948212085456005,2026-04-03 15:18:52.254433,2026-04-03 15:18:52.667945,0 days 00:00:00.413512,4,2,logistic,0.710016783039821,6.661123484118568,COMPLETE
362,12.965532642733175,2026-04-03 15:18:52.668063,2026-04-03 15:18:53.119849,0 days 00:00:00.451786,4,2,threshold,0.7549884433413971,6.24844858563159,COMPLETE
363,13.577848510305863,2026-04-03 15:18:53.119967,2026-04-03 15:18:53.532840,0 days 00:00:00.412873,4,2,logistic,0.7249874148569581,5.055911816436802,COMPLETE
364,13.577848510305863,2026-04-03 15:18:53.532961,2026-04-03 15:18:53.950755,0 days 00:00:00.417794,4,2,threshold,0.7398570174014596,5.229898062703311,COMPLETE
365,7.2137439410583175,2026-04-03 15:18:53.950871,2026-04-03 15:18:54.355951,0 days 00:00:00.405080,3,1,threshold,0.7340571387179164,5.616047753927759,COMPLETE
366,12.948212085456005,2026-04-03 15:18:54.356069,2026-04-03 15:18:54.771212,0 days 00:00:00.415143,4,2,logistic,0.7196013654152601,5.430514187691197,COMPLETE
367,12.965532642733175,2026-04-03 15:18:54.771329,2026-04-03 15:18:55.186032,0 days 00:00:00.414703,4,2,threshold,0.7500719571773837,5.763691766992043,COMPLETE
368,13.577848510305863,2026-04-03 15:18:55.186150,2026-04-03 15:18:55.601002,0 days 00:00:00.414852,4,2,threshold,0.741106868409957,6.452455978439781,COMPLETE
369,12.965532642733175,2026-04-03 15:18:55.601121,2026-04-03 15:18:56.028411,0 days 00:00:00.427290,4,2,logistic,0.7611975459570594,5.970100203056914,COMPLETE
370,13.577848510305863,2026-04-03 15:18:56.028530,2026-04-03 15:18:56.483044,0 days 00:00:00.454514,4,2,threshold,0.7281316136923328,5.157420927898189,COMPLETE
371,13.577848510305863,2026-04-03 15:18:56.483161,2026-04-03 15:18:56.900855,0 days 00:00:00.417694,4,2,logistic,0.7450971385712787,5.519446563112048,COMPLETE
372,2.6267423900416906,2026-04-03 15:18:56.900979,2026-04-03 15:18:57.366906,0 days 00:00:00.465927,5,2,threshold,0.7340657425064548,6.343654772354735,COMPLETE
373,12.948212085456005,2026-04-03 15:18:57.367023,2026-04-03 15:18:57.784693,0 days 00:00:00.417670,4,2,threshold,0.7174443985565924,5.3178366533017165,COMPLETE
374,8.460510031137398,2026-04-03 15:18:57.784811,2026-04-03 15:18:58.198831,0 days 00:00:00.414020,4,2,logistic,0.9857898616095294,5.701494375522753,COMPLETE
375,12.948212085456005,2026-04-03 15:18:58.198953,2026-04-03 15:18:58.621997,0 days 00:00:00.423044,4,2,threshold,0.7060493527018368,6.19020695403684,COMPLETE
376,12.965532642733175,2026-04-03 15:18:58.622118,2026-04-03 15:18:59.035864,0 days 00:00:00.413746,4,2,threshold,0.7535809000788768,6.584262313377246,COMPLETE
377,13.577848510305863,2026-04-03 15:18:59.036005,2026-04-03 15:18:59.453681,0 days 00:00:00.417676,4,2,logistic,0.7263053066954457,5.393639911717833,COMPLETE
378,13.577848510305863,2026-04-03 15:18:59.453803,2026-04-03 15:18:59.912553,0 days 00:00:00.458750,4,2,threshold,0.7391749305419509,4.859618746882464,COMPLETE
379,13.577848510305863,2026-04-03 15:18:59.912670,2026-04-03 15:19:00.328140,0 days 00:00:00.415470,4,2,logistic,0.7449188814315763,5.584552484840344,COMPLETE
380,13.577848510305863,2026-04-03 15:19:00.328261,2026-04-03 15:19:00.746016,0 days 00:00:00.417755,4,2,threshold,0.7323280094002043,6.413979910183861,COMPLETE
381,13.577848510305863,2026-04-03 15:19:00.746144,2026-04-03 15:19:01.161632,0 days 00:00:00.415488,4,2,threshold,0.7245036146604134,5.858968941656601,COMPLETE
382,12.965532642733175,2026-04-03 15:19:01.161758,2026-04-03 15:19:01.574362,0 days 00:00:00.412604,4,2,logistic,0.7667006675939668,4.97760796127043,COMPLETE
383,13.577848510305863,2026-04-03 15:19:01.574481,2026-04-03 15:19:01.994755,0 days 00:00:00.420274,4,2,threshold,0.7375689298110352,6.74427636687464,COMPLETE
384,12.948212085456005,2026-04-03 15:19:01.994879,2026-04-03 15:19:02.407769,0 days 00:00:00.412890,4,2,threshold,0.7149106528715637,5.469501857060436,COMPLETE
385,12.965532642733175,2026-04-03 15:19:02.407884,2026-04-03 15:19:02.820012,0 days 00:00:00.412128,4,2,logistic,0.7496685441174145,6.114359284653181,COMPLETE
386,13.577848510305863,2026-04-03 15:19:02.820129,2026-04-03 15:19:03.274695,0 days 00:00:00.454566,4,2,threshold,0.7307985738505811,5.323708011348869,COMPLETE
387,13.577848510305863,2026-04-03 15:19:03.274813,2026-04-03 15:19:03.688381,0 days 00:00:00.413568,4,2,logistic,0.7422751380781277,5.171980741585452,COMPLETE
388,13.577848510305863,2026-04-03 15:19:03.688500,2026-04-03 15:19:04.103620,0 days 00:00:00.415120,4,2,threshold,0.7226156227818032,6.4947927827119445,COMPLETE
389,10.037786974955102,2026-04-03 15:19:04.103751,2026-04-03 15:19:04.519434,0 days 00:00:00.415683,4,2,threshold,0.9025673073280666,5.62297691866243,COMPLETE
390,12.965532642733175,2026-04-03 15:19:04.519555,2026-04-03 15:19:04.934440,0 days 00:00:00.414885,4,2,logistic,0.7567375815264294,6.322790661001147,COMPLETE
391,13.577848510305863,2026-04-03 15:19:04.934558,2026-04-03 15:19:05.347921,0 days 00:00:00.413363,4,2,threshold,0.7363666731108136,5.735031436960476,COMPLETE
392,12.965532642733175,2026-04-03 15:19:05.348038,2026-04-03 15:19:05.761154,0 days 00:00:00.413116,4,2,threshold,0.747947761428921,4.7235154580166805,COMPLETE
393,13.577848510305863,2026-04-03 15:19:05.761275,2026-04-03 15:19:06.216329,0 days 00:00:00.455054,4,2,logistic,0.7324049386070155,5.51171952399867,COMPLETE
394,12.948212085456005,2026-04-03 15:19:06.216464,2026-04-03 15:19:06.629021,0 days 00:00:00.412557,4,2,threshold,0.7148958755643965,6.005615168611919,COMPLETE
395,13.577848510305863,2026-04-03 15:19:06.629138,2026-04-03 15:19:07.142273,0 days 00:00:00.513135,4,2,logistic,0.7409762199171835,5.283801489893878,COMPLETE
396,13.577848510305863,2026-04-03 15:19:07.142393,2026-04-03 15:19:07.556873,0 days 00:00:00.414480,4,2,threshold,0.7260920349390475,6.602904658619473,COMPLETE
397,12.965532642733175,2026-04-03 15:19:07.556991,2026-04-03 15:19:07.969523,0 days 00:00:00.412532,4,2,threshold,0.7532456841657869,5.074961507145635,COMPLETE
398,13.577848510305863,2026-04-03 15:19:07.969640,2026-04-03 15:19:08.391798,0 days 00:00:00.422158,4,2,logistic,0.7440419895163944,5.369228536429601,COMPLETE
399,13.577848510305863,2026-04-03 15:19:08.391945,2026-04-03 15:19:08.809447,0 days 00:00:00.417502,4,2,threshold,0.7325516969895558,5.589842886852096,COMPLETE
400,12.965532642733175,2026-04-03 15:19:08.809568,2026-04-03 15:19:09.248144,0 days 00:00:00.438576,4,2,threshold,0.8132348641849396,5.926979341507422,COMPLETE
401,12.948212085456005,2026-04-03 15:19:09.248407,2026-04-03 15:19:09.829359,0 days 00:00:00.580952,4,2,logistic,0.7078156054365716,6.2342102449735135,COMPLETE
402,13.577848510305863,2026-04-03 15:19:09.829482,2026-04-03 15:19:10.416029,0 days 00:00:00.586547,4,2,threshold,0.7227742862987173,5.483805840988916,COMPLETE
403,12.965532642733175,2026-04-03 15:19:10.416163,2026-04-03 15:19:10.843803,0 days 00:00:00.427640,4,2,logistic,0.7609011752860282,4.389335589299428,COMPLETE
404,13.577848510305863,2026-04-03 15:19:10.843932,2026-04-03 15:19:11.261366,0 days 00:00:00.417434,4,2,threshold,0.7379891056402912,5.239610889630444,COMPLETE
405,12.965532642733175,2026-04-03 15:19:11.261489,2026-04-03 15:19:11.675752,0 days 00:00:00.414263,4,2,threshold,0.7483317590345966,6.870344531356854,COMPLETE
406,13.577848510305863,2026-04-03 15:19:11.675874,2026-04-03 15:19:12.089352,0 days 00:00:00.413478,4,2,logistic,0.7287769720967835,5.802485372798987,COMPLETE
407,13.577848510305863,2026-04-03 15:19:12.089474,2026-04-03 15:19:12.502034,0 days 00:00:00.412560,4,2,threshold,0.7379690491575835,6.42206453355476,COMPLETE
