number,value,datetime_start,datetime_complete,duration,params_hmm_components,params_hmm_favourable,params_hmm_gate,params_hmm_threshold,params_hmm_train_years,state
0,4.542679978992411,2026-04-03 15:16:15.445462,2026-04-03 15:16:17.160466,0 days 00:00:01.715004,3,1,threshold,0.9707785794998673,3.7800932022121825,COMPLETE
1,12.623997772725678,2026-04-03 15:16:17.160660,2026-04-03 15:16:17.549520,0 days 00:00:00.388860,2,1,threshold,0.6226526087455978,6.540362888980227,COMPLETE
2,12.23640528596053,2026-04-03 15:16:17.549651,2026-04-03 15:16:17.937980,0 days 00:00:00.388329,2,1,threshold,0.9782648423431778,3.9091248360355033,COMPLETE
3,12.623997772725678,2026-04-03 15:16:17.938102,2026-04-03 15:16:18.393317,0 days 00:00:00.455215,2,1,threshold,0.7186544747542197,4.456145700990209,COMPLETE
4,1.9666599174241857,2026-04-03 15:16:18.393435,2026-04-03 15:16:18.840349,0 days 00:00:00.446914,5,1,logistic,0.7139364129287351,6.925879806965068,COMPLETE
5,12.984244697268876,2026-04-03 15:16:18.840468,2026-04-03 15:16:19.231384,0 days 00:00:00.390916,2,1,threshold,0.8005514309813085,6.037724259507192,COMPLETE
6,12.623997772725678,2026-04-03 15:16:19.231507,2026-04-03 15:16:19.619805,0 days 00:00:00.388298,2,1,logistic,0.625370121264259,7.041986740582305,COMPLETE
7,6.880387049964018,2026-04-03 15:16:19.619922,2026-04-03 15:16:20.022129,0 days 00:00:00.402207,3,1,threshold,0.6380921244624896,3.6101911742238944,COMPLETE
8,1.4174785019612028,2026-04-03 15:16:20.022249,2026-04-03 15:16:20.420631,0 days 00:00:00.398382,4,1,logistic,0.954634956810725,4.558555380447054,COMPLETE
9,12.928162568324508,2026-04-03 15:16:20.420746,2026-04-03 15:16:20.828422,0 days 00:00:00.407676,4,2,threshold,0.6720932376549555,7.697494707820946,COMPLETE
10,5.0533998636437465,2026-04-03 15:16:20.828543,2026-04-03 15:16:21.279459,0 days 00:00:00.450916,6,3,logistic,0.8714859433097453,5.512656088373982,COMPLETE
11,12.965532642733175,2026-04-03 15:16:21.279589,2026-04-03 15:16:21.688663,0 days 00:00:00.409074,4,2,threshold,0.8104533097351944,7.983052969145729,COMPLETE
12,3.531955444681429,2026-04-03 15:16:21.688785,2026-04-03 15:16:22.144524,0 days 00:00:00.455739,5,2,threshold,0.8091305752615667,5.924915785043908,COMPLETE
13,6.673498745183344,2026-04-03 15:16:22.144645,2026-04-03 15:16:22.544127,0 days 00:00:00.399482,3,1,threshold,0.8127178768536046,7.74755839006249,COMPLETE
14,5.168724127297726,2026-04-03 15:16:22.544246,2026-04-03 15:16:22.967084,0 days 00:00:00.422838,6,3,threshold,0.8818631337263312,6.051721250501007,COMPLETE
15,2.6267423900416906,2026-04-03 15:16:22.967203,2026-04-03 15:16:23.423673,0 days 00:00:00.456470,5,2,threshold,0.7580201062132665,5.096368328393563,COMPLETE
16,5.741898566758988,2026-04-03 15:16:23.423788,2026-04-03 15:16:23.824785,0 days 00:00:00.400997,3,1,threshold,0.871424974158167,3.127747474052716,COMPLETE
17,12.965532642733175,2026-04-03 15:16:23.824907,2026-04-03 15:16:24.261759,0 days 00:00:00.436852,4,2,threshold,0.7799478873998862,7.152710330855598,COMPLETE
18,4.54768851634016,2026-04-03 15:16:24.261883,2026-04-03 15:16:24.718193,0 days 00:00:00.456310,5,2,logistic,0.8420421132882898,7.867998352859681,COMPLETE
19,5.684565097583865,2026-04-03 15:16:24.718314,2026-04-03 15:16:25.121597,0 days 00:00:00.403283,3,1,threshold,0.9199841787428098,6.308851073086485,COMPLETE
20,13.577848510305863,2026-04-03 15:16:25.121721,2026-04-03 15:16:25.533318,0 days 00:00:00.411597,4,2,threshold,0.7370934466719526,5.320832480224756,COMPLETE
21,13.577848510305863,2026-04-03 15:16:25.533439,2026-04-03 15:16:25.945843,0 days 00:00:00.412404,4,2,threshold,0.7260988814270123,5.298356408716008,COMPLETE
22,13.577848510305863,2026-04-03 15:16:25.945973,2026-04-03 15:16:26.355724,0 days 00:00:00.409751,4,2,threshold,0.7411411976782379,5.2341822255428925,COMPLETE
23,12.948212085456005,2026-04-03 15:16:26.355845,2026-04-03 15:16:26.792132,0 days 00:00:00.436287,4,2,threshold,0.6967438369380402,5.096145342712912,COMPLETE
24,13.577848510305863,2026-04-03 15:16:26.792258,2026-04-03 15:16:27.202089,0 days 00:00:00.409831,4,2,threshold,0.7458451366632045,5.3149700815885055,COMPLETE
25,2.6267423900416906,2026-04-03 15:16:27.202209,2026-04-03 15:16:27.657850,0 days 00:00:00.455641,5,2,threshold,0.676706737047795,4.598032987433842,COMPLETE
26,13.577848510305863,2026-04-03 15:16:27.657968,2026-04-03 15:16:28.068181,0 days 00:00:00.410213,4,2,logistic,0.7402421150775074,5.554905216334951,COMPLETE
27,12.965532642733175,2026-04-03 15:16:28.068298,2026-04-03 15:16:28.485343,0 days 00:00:00.417045,4,2,threshold,0.768424536539874,4.946504226914569,COMPLETE
28,2.6267423900416906,2026-04-03 15:16:28.485463,2026-04-03 15:16:28.946894,0 days 00:00:00.461431,5,2,threshold,0.6594284128128589,4.210834964644741,COMPLETE
29,7.2137439410583175,2026-04-03 15:16:28.947012,2026-04-03 15:16:29.346432,0 days 00:00:00.399420,3,1,threshold,0.7259954284233748,5.740316958226738,COMPLETE
30,7.2137439410583175,2026-04-03 15:16:29.346549,2026-04-03 15:16:29.778072,0 days 00:00:00.431523,3,1,threshold,0.6945270080299734,4.849078874264242,COMPLETE
31,12.965532642733175,2026-04-03 15:16:29.778193,2026-04-03 15:16:30.191058,0 days 00:00:00.412865,4,2,threshold,0.7496277352919508,5.294987113003622,COMPLETE
32,12.965532642733175,2026-04-03 15:16:30.191176,2026-04-03 15:16:30.599607,0 days 00:00:00.408431,4,2,threshold,0.7832277853673555,5.341261517811633,COMPLETE
33,13.577848510305863,2026-04-03 15:16:30.599722,2026-04-03 15:16:31.012059,0 days 00:00:00.412337,4,2,threshold,0.7399668151413712,6.503112223348747,COMPLETE
34,12.948212085456005,2026-04-03 15:16:31.012183,2026-04-03 15:16:31.421068,0 days 00:00:00.408885,4,2,threshold,0.7098057336649125,4.74684762440576,COMPLETE
35,4.54768851634016,2026-04-03 15:16:31.421187,2026-04-03 15:16:31.876572,0 days 00:00:00.455385,5,2,threshold,0.8353826656266138,4.113619808626641,COMPLETE
36,12.928162568324508,2026-04-03 15:16:31.876691,2026-04-03 15:16:32.285468,0 days 00:00:00.408777,4,2,threshold,0.6053196471075999,5.622504545593876,COMPLETE
37,2.6267423900416906,2026-04-03 15:16:32.285589,2026-04-03 15:16:32.772914,0 days 00:00:00.487325,5,2,logistic,0.7330231089061645,5.273196213533041,COMPLETE
38,6.880387049964018,2026-04-03 15:16:32.773038,2026-04-03 15:16:33.175870,0 days 00:00:00.402832,3,1,threshold,0.651752246459792,4.308993728723026,COMPLETE
39,12.948212085456005,2026-04-03 15:16:33.175996,2026-04-03 15:16:33.586844,0 days 00:00:00.410848,4,2,threshold,0.6983628406548006,3.859842260229904,COMPLETE
40,7.2137439410583175,2026-04-03 15:16:33.586964,2026-04-03 15:16:33.987234,0 days 00:00:00.400270,3,1,threshold,0.7661946970063191,5.901332302982157,COMPLETE
41,13.577848510305863,2026-04-03 15:16:33.987360,2026-04-03 15:16:34.395191,0 days 00:00:00.407831,4,2,logistic,0.7427877550350752,5.59667706557117,COMPLETE
42,12.948212085456005,2026-04-03 15:16:34.395307,2026-04-03 15:16:34.804299,0 days 00:00:00.408992,4,2,logistic,0.7185461448277688,6.212641755465936,COMPLETE
43,12.928162568324508,2026-04-03 15:16:34.804419,2026-04-03 15:16:35.211631,0 days 00:00:00.407212,4,2,logistic,0.6812428506488124,5.105390667105431,COMPLETE
44,2.6267423900416906,2026-04-03 15:16:35.211752,2026-04-03 15:16:35.696093,0 days 00:00:00.484341,5,2,logistic,0.7948598013945448,5.414272305451256,COMPLETE
45,12.965532642733175,2026-04-03 15:16:35.696216,2026-04-03 15:16:36.105841,0 days 00:00:00.409625,4,2,logistic,0.7569606220812587,5.765424527918398,COMPLETE
46,12.948212085456005,2026-04-03 15:16:36.105962,2026-04-03 15:16:36.516909,0 days 00:00:00.410947,4,2,logistic,0.7139152559938942,4.771457552246876,COMPLETE
47,12.623997772725678,2026-04-03 15:16:36.517029,2026-04-03 15:16:36.908488,0 days 00:00:00.391459,2,1,logistic,0.7316084182994975,6.796366027977328,COMPLETE
48,6.673498745183344,2026-04-03 15:16:36.908605,2026-04-03 15:16:37.312858,0 days 00:00:00.404253,3,1,threshold,0.7940811624562023,4.518651368338103,COMPLETE
49,12.965532642733175,2026-04-03 15:16:37.312986,2026-04-03 15:16:37.722267,0 days 00:00:00.409281,4,2,threshold,0.8323641972765532,5.050290022990737,COMPLETE
50,12.965532642733175,2026-04-03 15:16:37.722390,2026-04-03 15:16:38.131673,0 days 00:00:00.409283,4,2,logistic,0.7786244650252141,6.203034210362819,COMPLETE
51,13.577848510305863,2026-04-03 15:16:38.131796,2026-04-03 15:16:38.570218,0 days 00:00:00.438422,4,2,threshold,0.7386355054876406,6.504155824680474,COMPLETE
52,12.965532642733175,2026-04-03 15:16:38.570346,2026-04-03 15:16:38.982395,0 days 00:00:00.412049,4,2,threshold,0.7505613377830465,7.424333141500366,COMPLETE
53,12.948212085456005,2026-04-03 15:16:38.982520,2026-04-03 15:16:39.392507,0 days 00:00:00.409987,4,2,threshold,0.7057976151767686,6.688707159037173,COMPLETE
54,2.6267423900416906,2026-04-03 15:16:39.392626,2026-04-03 15:16:39.851558,0 days 00:00:00.458932,5,2,threshold,0.7657550475363908,5.442850509668516,COMPLETE
55,13.577848510305863,2026-04-03 15:16:39.851679,2026-04-03 15:16:40.259384,0 days 00:00:00.407705,4,2,threshold,0.7279620075345611,6.022500888669958,COMPLETE
56,12.928162568324508,2026-04-03 15:16:40.259512,2026-04-03 15:16:40.671893,0 days 00:00:00.412381,4,2,threshold,0.6907335843606586,6.449189010498108,COMPLETE
57,2.6267423900416906,2026-04-03 15:16:40.672013,2026-04-03 15:16:41.128715,0 days 00:00:00.456702,5,2,threshold,0.6593474117965552,5.804364184165507,COMPLETE
58,7.2137439410583175,2026-04-03 15:16:41.128836,2026-04-03 15:16:41.563214,0 days 00:00:00.434378,3,1,threshold,0.7470347120612234,5.201457492667771,COMPLETE
59,12.965532642733175,2026-04-03 15:16:41.563330,2026-04-03 15:16:41.977222,0 days 00:00:00.413892,4,2,threshold,0.817772059854697,5.520020740066309,COMPLETE
60,4.6323997609532235,2026-04-03 15:16:41.977338,2026-04-03 15:16:42.394763,0 days 00:00:00.417425,6,3,threshold,0.9894699636981215,4.893300168002382,COMPLETE
61,13.577848510305863,2026-04-03 15:16:42.394881,2026-04-03 15:16:42.806741,0 days 00:00:00.411860,4,2,logistic,0.7399148360016874,5.599732796960522,COMPLETE
62,13.577848510305863,2026-04-03 15:16:42.806865,2026-04-03 15:16:43.225000,0 days 00:00:00.418135,4,2,logistic,0.7230442185016512,5.672204414977774,COMPLETE
63,12.965532642733175,2026-04-03 15:16:43.225154,2026-04-03 15:16:43.654773,0 days 00:00:00.429619,4,2,logistic,0.7818923120668428,4.689900976648078,COMPLETE
64,13.577848510305863,2026-04-03 15:16:43.654909,2026-04-03 15:16:44.064696,0 days 00:00:00.409787,4,2,logistic,0.7423374539335018,4.98099699743117,COMPLETE
65,12.965532642733175,2026-04-03 15:16:44.064816,2026-04-03 15:16:44.510262,0 days 00:00:00.445446,4,2,logistic,0.7615184773772633,5.203899566956353,COMPLETE
66,7.2137439410583175,2026-04-03 15:16:44.510384,2026-04-03 15:16:44.911055,0 days 00:00:00.400671,3,1,logistic,0.7160608380651907,6.045591581120244,COMPLETE
67,12.928162568324508,2026-04-03 15:16:44.911175,2026-04-03 15:16:45.323091,0 days 00:00:00.411916,4,2,threshold,0.6879058456031825,7.048694021050639,COMPLETE
68,12.965532642733175,2026-04-03 15:16:45.323210,2026-04-03 15:16:45.733000,0 days 00:00:00.409790,4,2,threshold,0.7761088534452062,3.5815697645396387,COMPLETE
69,2.6267423900416906,2026-04-03 15:16:45.733117,2026-04-03 15:16:46.214772,0 days 00:00:00.481655,5,2,threshold,0.7036087682219935,5.481836133261484,COMPLETE
70,7.2137439410583175,2026-04-03 15:16:46.214900,2026-04-03 15:16:46.617718,0 days 00:00:00.402818,3,1,logistic,0.7512713707985799,5.812291478350183,COMPLETE
71,13.577848510305863,2026-04-03 15:16:46.617834,2026-04-03 15:16:47.084982,0 days 00:00:00.467148,4,2,threshold,0.7380394787938059,6.281890685989874,COMPLETE
72,13.577848510305863,2026-04-03 15:16:47.085128,2026-04-03 15:16:47.539523,0 days 00:00:00.454395,4,2,threshold,0.7325443616436561,6.5329576952856225,COMPLETE
73,12.928162568324508,2026-04-03 15:16:47.539667,2026-04-03 15:16:48.000490,0 days 00:00:00.460823,4,2,threshold,0.6704983399150656,5.28951818970937,COMPLETE
74,12.948212085456005,2026-04-03 15:16:48.000653,2026-04-03 15:16:48.440642,0 days 00:00:00.439989,4,2,threshold,0.7220100670139044,7.301194397249982,COMPLETE
75,12.965532642733175,2026-04-03 15:16:48.440767,2026-04-03 15:16:48.919468,0 days 00:00:00.478701,4,2,threshold,0.7677289349707354,6.7503807703117085,COMPLETE
76,12.965532642733175,2026-04-03 15:16:48.919599,2026-04-03 15:16:49.330859,0 days 00:00:00.411260,4,2,threshold,0.7887943541359669,6.386354436435497,COMPLETE
77,9.808326768326674,2026-04-03 15:16:49.330981,2026-04-03 15:16:49.773417,0 days 00:00:00.442436,4,2,threshold,0.9475423525238333,5.9439232212096815,COMPLETE
78,7.2137439410583175,2026-04-03 15:16:49.773540,2026-04-03 15:16:50.178256,0 days 00:00:00.404716,3,1,threshold,0.7579179898520615,5.129957864381338,COMPLETE
79,2.6267423900416906,2026-04-03 15:16:50.178388,2026-04-03 15:16:50.667160,0 days 00:00:00.488772,5,2,logistic,0.7073268885925623,5.367760834790434,COMPLETE
80,13.577848510305863,2026-04-03 15:16:50.667281,2026-04-03 15:16:51.078936,0 days 00:00:00.411655,4,2,threshold,0.7417969618836194,5.588967380090446,COMPLETE
81,13.577848510305863,2026-04-03 15:16:51.079059,2026-04-03 15:16:51.490463,0 days 00:00:00.411404,4,2,threshold,0.7277886104947254,5.9448151796151985,COMPLETE
82,12.965532642733175,2026-04-03 15:16:51.490587,2026-04-03 15:16:51.905260,0 days 00:00:00.414673,4,2,threshold,0.8049249509664864,6.158425610408358,COMPLETE
83,13.577848510305863,2026-04-03 15:16:51.905381,2026-04-03 15:16:52.314523,0 days 00:00:00.409142,4,2,threshold,0.7259184438693399,6.63809000478824,COMPLETE
84,12.965532642733175,2026-04-03 15:16:52.314647,2026-04-03 15:16:52.725730,0 days 00:00:00.411083,4,2,threshold,0.7525295778218295,6.877939755717224,COMPLETE
85,12.948212085456005,2026-04-03 15:16:52.725857,2026-04-03 15:16:53.167261,0 days 00:00:00.441404,4,2,threshold,0.7113937165254665,6.067683466603275,COMPLETE
86,13.577848510305863,2026-04-03 15:16:53.167401,2026-04-03 15:16:53.575827,0 days 00:00:00.408426,4,2,threshold,0.7352280272012962,6.526872160324591,COMPLETE
87,12.965532642733175,2026-04-03 15:16:53.575943,2026-04-03 15:16:53.983719,0 days 00:00:00.407776,4,2,threshold,0.7684203274587766,5.681384579603751,COMPLETE
88,12.948212085456005,2026-04-03 15:16:53.983838,2026-04-03 15:16:54.393724,0 days 00:00:00.409886,4,2,logistic,0.6966450612809819,4.995631309959641,COMPLETE
89,2.6267423900416906,2026-04-03 15:16:54.393841,2026-04-03 15:16:54.855333,0 days 00:00:00.461492,5,2,threshold,0.7733605353486269,5.8609497508617645,COMPLETE
90,13.577848510305863,2026-04-03 15:16:54.855449,2026-04-03 15:16:55.270701,0 days 00:00:00.415252,4,2,threshold,0.7459480073339799,5.437486070028457,COMPLETE
91,13.577848510305863,2026-04-03 15:16:55.270825,2026-04-03 15:16:55.679857,0 days 00:00:00.409032,4,2,logistic,0.7356778941409183,5.549216658235712,COMPLETE
92,12.948212085456005,2026-04-03 15:16:55.679973,2026-04-03 15:16:56.119720,0 days 00:00:00.439747,4,2,logistic,0.72140000004389,5.21786771949696,COMPLETE
93,12.965532642733175,2026-04-03 15:16:56.119849,2026-04-03 15:16:56.528260,0 days 00:00:00.408411,4,2,logistic,0.7581123437936833,5.709868429145445,COMPLETE
94,13.577848510305863,2026-04-03 15:16:56.528379,2026-04-03 15:16:56.939672,0 days 00:00:00.411293,4,2,logistic,0.7441806596709424,5.367830956327206,COMPLETE
95,12.928162568324508,2026-04-03 15:16:56.939793,2026-04-03 15:16:57.349950,0 days 00:00:00.410157,4,2,logistic,0.6816476258335852,5.58074608933381,COMPLETE
96,12.948212085456005,2026-04-03 15:16:57.350070,2026-04-03 15:16:57.757729,0 days 00:00:00.407659,4,2,logistic,0.7150257441782142,5.98966745725288,COMPLETE
97,13.577848510305863,2026-04-03 15:16:57.757852,2026-04-03 15:16:58.170073,0 days 00:00:00.412221,4,2,threshold,0.7295904404948474,6.098673716251636,COMPLETE
98,12.948212085456005,2026-04-03 15:16:58.170198,2026-04-03 15:16:58.607416,0 days 00:00:00.437218,4,2,logistic,0.7042991059641572,4.850928091591556,COMPLETE
99,13.577848510305863,2026-04-03 15:16:58.607535,2026-04-03 15:16:59.049300,0 days 00:00:00.441765,4,2,threshold,0.739379133868817,6.384175955480341,COMPLETE
100,12.965532642733175,2026-04-03 15:16:59.049425,2026-04-03 15:16:59.458759,0 days 00:00:00.409334,4,2,logistic,0.7518460736077882,5.7711419080440605,COMPLETE
101,12.948212085456005,2026-04-03 15:16:59.458882,2026-04-03 15:16:59.869181,0 days 00:00:00.410299,4,2,logistic,0.7205700084763028,5.614382297187575,COMPLETE
102,13.577848510305863,2026-04-03 15:16:59.869301,2026-04-03 15:17:00.279301,0 days 00:00:00.410000,4,2,logistic,0.7271194228925035,5.672473496379608,COMPLETE
103,12.965532642733175,2026-04-03 15:17:00.279418,2026-04-03 15:17:00.689031,0 days 00:00:00.409613,4,2,logistic,0.7600514697793208,5.26189040829071,COMPLETE
104,13.577848510305863,2026-04-03 15:17:00.689156,2026-04-03 15:17:01.098243,0 days 00:00:00.409087,4,2,logistic,0.7397696584506858,5.132507884983974,COMPLETE
105,12.948212085456005,2026-04-03 15:17:01.098367,2026-04-03 15:17:01.509558,0 days 00:00:00.411191,4,2,logistic,0.7013712679439762,5.3968183897646655,COMPLETE
106,12.948212085456005,2026-04-03 15:17:01.509683,2026-04-03 15:17:01.952141,0 days 00:00:00.442458,4,2,threshold,0.7166089198181189,5.483575104308396,COMPLETE
107,12.965532642733175,2026-04-03 15:17:01.952259,2026-04-03 15:17:02.361752,0 days 00:00:00.409493,4,2,threshold,0.7863262484293787,5.891006167023859,COMPLETE
108,12.928162568324508,2026-04-03 15:17:02.361872,2026-04-03 15:17:02.771665,0 days 00:00:00.409793,4,2,logistic,0.6885467331723781,5.343541235028931,COMPLETE
109,13.577848510305863,2026-04-03 15:17:02.771785,2026-04-03 15:17:03.179730,0 days 00:00:00.407945,4,2,threshold,0.7440496169176559,5.051752942621399,COMPLETE
110,13.577848510305863,2026-04-03 15:17:03.179855,2026-04-03 15:17:03.588523,0 days 00:00:00.408668,4,2,threshold,0.7302179053532812,6.275595219756528,COMPLETE
111,13.577848510305863,2026-04-03 15:17:03.588639,2026-04-03 15:17:04.001146,0 days 00:00:00.412507,4,2,logistic,0.744743053909743,4.634016948832576,COMPLETE
112,12.965532642733175,2026-04-03 15:17:04.001266,2026-04-03 15:17:04.410605,0 days 00:00:00.409339,4,2,logistic,0.7510822466321295,4.9537484639029365,COMPLETE
113,12.948212085456005,2026-04-03 15:17:04.410725,2026-04-03 15:17:04.851722,0 days 00:00:00.440997,4,2,logistic,0.7102436396995515,4.765292739797045,COMPLETE
114,12.965532642733175,2026-04-03 15:17:04.851846,2026-04-03 15:17:05.260260,0 days 00:00:00.408414,4,2,logistic,0.7648459113749991,5.166967637100912,COMPLETE
115,12.965532642733175,2026-04-03 15:17:05.260387,2026-04-03 15:17:05.674364,0 days 00:00:00.413977,4,2,logistic,0.7751679366617114,5.511180395701042,COMPLETE
116,13.577848510305863,2026-04-03 15:17:05.674509,2026-04-03 15:17:06.086248,0 days 00:00:00.411739,4,2,threshold,0.7380029891558644,5.00511419434473,COMPLETE
117,12.623997772725678,2026-04-03 15:17:06.086369,2026-04-03 15:17:06.478037,0 days 00:00:00.391668,2,1,logistic,0.7246383626689349,5.708652411088797,COMPLETE
118,12.965532642733175,2026-04-03 15:17:06.478156,2026-04-03 15:17:06.886574,0 days 00:00:00.408418,4,2,threshold,0.7571700700440133,5.29896237087702,COMPLETE
119,12.948212085456005,2026-04-03 15:17:06.886694,2026-04-03 15:17:07.296247,0 days 00:00:00.409553,4,2,threshold,0.7212194044245704,5.837833203402099,COMPLETE
120,13.577848510305863,2026-04-03 15:17:07.296368,2026-04-03 15:17:07.747668,0 days 00:00:00.451300,4,2,logistic,0.7352441361931026,6.603538597657517,COMPLETE
121,13.577848510305863,2026-04-03 15:17:07.747794,2026-04-03 15:17:08.157149,0 days 00:00:00.409355,4,2,threshold,0.7397804879837475,6.301510566403335,COMPLETE
122,13.577848510305863,2026-04-03 15:17:08.157301,2026-04-03 15:17:08.568227,0 days 00:00:00.410926,4,2,threshold,0.7321663925601002,6.428808122145178,COMPLETE
123,12.965532642733175,2026-04-03 15:17:08.568345,2026-04-03 15:17:08.977389,0 days 00:00:00.409044,4,2,threshold,0.7544842802769989,6.213068156316607,COMPLETE
124,12.948212085456005,2026-04-03 15:17:08.977508,2026-04-03 15:17:09.390642,0 days 00:00:00.413134,4,2,threshold,0.7121494245300477,5.612949166529903,COMPLETE
125,13.577848510305863,2026-04-03 15:17:09.390761,2026-04-03 15:17:09.802786,0 days 00:00:00.412025,4,2,threshold,0.7461555986797721,6.128365440237829,COMPLETE
126,12.965532642733175,2026-04-03 15:17:09.802928,2026-04-03 15:17:10.211355,0 days 00:00:00.408427,4,2,threshold,0.7702153936539791,6.976346330764126,COMPLETE
127,13.577848510305863,2026-04-03 15:17:10.211475,2026-04-03 15:17:10.658476,0 days 00:00:00.447001,4,2,threshold,0.7247680618877553,5.425940107443685,COMPLETE
128,12.965532642733175,2026-04-03 15:17:10.658595,2026-04-03 15:17:11.072139,0 days 00:00:00.413544,4,2,logistic,0.763188367369208,6.742290015161913,COMPLETE
129,9.63260356188465,2026-04-03 15:17:11.072266,2026-04-03 15:17:11.482561,0 days 00:00:00.410295,4,2,threshold,0.8987832271762453,5.97667225224406,COMPLETE
130,13.577848510305863,2026-04-03 15:17:11.482680,2026-04-03 15:17:11.899565,0 days 00:00:00.416885,4,2,threshold,0.7380532577970801,6.509665849448663,COMPLETE
131,13.577848510305863,2026-04-03 15:17:11.899684,2026-04-03 15:17:12.309481,0 days 00:00:00.409797,4,2,threshold,0.7317329939354944,6.590734531115916,COMPLETE
132,12.965532642733175,2026-04-03 15:17:12.309608,2026-04-03 15:17:12.718647,0 days 00:00:00.409039,4,2,threshold,0.7481512668698574,6.297755491284583,COMPLETE
133,12.948212085456005,2026-04-03 15:17:12.718776,2026-04-03 15:17:13.129256,0 days 00:00:00.410480,4,2,threshold,0.7214448522986747,6.489441572012219,COMPLETE
134,13.577848510305863,2026-04-03 15:17:13.129376,2026-04-03 15:17:13.572411,0 days 00:00:00.443035,4,2,threshold,0.7304212039106779,5.2219896857779915,COMPLETE
135,12.948212085456005,2026-04-03 15:17:13.572531,2026-04-03 15:17:13.985411,0 days 00:00:00.412880,4,2,threshold,0.6976929273967283,6.394697013839633,COMPLETE
